content,score,at,thumbsUpCount,source,app_name,text
"Loved the app overall. Hoping mobile view database has more options to make it more minimalistic look. The filters and sort settings are always in view and no way to hide, adding to the clutter when I only just want to navigate on my board view. Will also appreciate an offline mode that's quick and doesn't lag or have delays. Sometimes when I type or do changes, and my network is not so good, there's always risk that my changes will get erased or messed up because of syncing issues.",4,2024-10-10 07:34:14,81,play_store,Notion,"Loved the app overall. Hoping mobile view database has more options to make it more minimalistic look. The filters and sort settings are always in view and no way to hide, adding to the clutter when I only just want to navigate on my board view. Will also appreciate an offline mode that's quick and doesn't lag or have delays. Sometimes when I type or do changes, and my network is not so good, there's always risk that my changes will get erased or messed up because of syncing issues."
"Awesome software, great app and marvellous experience. I love all of the new features you're constantly putting out and all of your brand and communication. One star is missing because of this little issue: when I shift my account (and workspace), widgets of my first account disappear from the home screen. So please please please focus on stability while growing and implementing new functionalities. Hoping to hear from you soon!",4,2025-03-31 21:58:10,181,play_store,Notion,"Awesome software, great app and marvellous experience. I love all of the new features you're constantly putting out and all of your brand and communication. One star is missing because of this little issue: when I shift my account (and workspace), widgets of my first account disappear from the home screen. So please please please focus on stability while growing and implementing new functionalities. Hoping to hear from you soon!"
"Perfect for planning, organizing trackers, and just being more clear about my own life and responsibilities and plans on general. If you need your life to feel more clear and want to feel more in control, this is perfect. One bad thing about it is you do have to slowly learn how it works, and if you want to create a page yourself youre going to have to figure out the design etc, but once you are clear about everything and the controls it should be good. (phone ver sucks, laptop recommended)",5,2026-03-12 16:23:13,9,play_store,Notion,"Perfect for planning, organizing trackers, and just being more clear about my own life and responsibilities and plans on general. If you need your life to feel more clear and want to feel more in control, this is perfect. One bad thing about it is you do have to slowly learn how it works, and if you want to create a page yourself youre going to have to figure out the design etc, but once you are clear about everything and the controls it should be good. (phone ver sucks, laptop recommended)"
Cons: Offline mode is kind of mid since it tends to crash etc. also it's a bit annoying that the app continuously proposes using AI even when you'd need to pay for it. even if you'd treat it as an add I don't think that in this kind of app where you're supposed to write a lot (the minimalistic style is what brought me to install) constant pop-ups are really off putting. Pros: The features of the app except the ones I find annoying (look point up) are great for people who don't want to pay.,4,2026-02-24 19:26:46,4,play_store,Notion,Cons: Offline mode is kind of mid since it tends to crash etc. also it's a bit annoying that the app continuously proposes using AI even when you'd need to pay for it. even if you'd treat it as an add I don't think that in this kind of app where you're supposed to write a lot (the minimalistic style is what brought me to install) constant pop-ups are really off putting. Pros: The features of the app except the ones I find annoying (look point up) are great for people who don't want to pay.
"Initially rated 2 stars for the forced AI features, but editing to 1 star because version history is fundamentally broken. I have a critical project that was living in Notion, and one of the pages had some text issues. I paid for the upgraded service in order to access versioning. When I try to restore the version, the app does nothing. Attempted on PC and mobile. They sell this as enterprise grade software. Absolutely embarrassing.",1,2026-03-26 06:23:02,4,play_store,Notion,"Initially rated 2 stars for the forced AI features, but editing to 1 star because version history is fundamentally broken. I have a critical project that was living in Notion, and one of the pages had some text issues. I paid for the upgraded service in order to access versioning. When I try to restore the version, the app does nothing. Attempted on PC and mobile. They sell this as enterprise grade software. Absolutely embarrassing."
"Notion has definitely helped me with my productivity. I used it for daily task, long-term study planning (from 1-6th semester of my uni), and for working and organizational purposes. Too bad that not many people use Notion. It'll take time for a beginner to navigate through the UI, but definitely worth using after you learn how to automate your task and synchronize it with the Google Calendar. P.S if you have ADHD: Don't over engineer your notion, keep it simple.",5,2026-03-31 08:40:09,0,play_store,Notion,"Notion has definitely helped me with my productivity. I used it for daily task, long-term study planning (from 1-6th semester of my uni), and for working and organizational purposes. Too bad that not many people use Notion. It'll take time for a beginner to navigate through the UI, but definitely worth using after you learn how to automate your task and synchronize it with the Google Calendar. P.S if you have ADHD: Don't over engineer your notion, keep it simple."
"keeps crashing becoming unusable, needs to be force closed and restarted from simply opening the keyboard to write on screen. it took three attempts to get logged in alone, because I had to write which email address to login with - in the end I gave up and used an alternative which didn't involve opening the keyboard. I have had it downloaded for all of five minutes and it crashed as many times and then some from the same thing. In theory, fantastic app. In practice, infuriating function.",2,2026-02-21 13:10:08,5,play_store,Notion,"keeps crashing becoming unusable, needs to be force closed and restarted from simply opening the keyboard to write on screen. it took three attempts to get logged in alone, because I had to write which email address to login with - in the end I gave up and used an alternative which didn't involve opening the keyboard. I have had it downloaded for all of five minutes and it crashed as many times and then some from the same thing. In theory, fantastic app. In practice, infuriating function."
"the service is great, but on other platforms. I use notion mostly for writing down some notes, and the app can't give me a smooth experience on this task. My onscreen keyboard (default Gboard) freaks out when I'm typing. Autosuggestion is not working half of the time, uppercase letters flash every few seconds, some symbols are not registering when I press on them. It makes notion pretty unusable for writing something down on the phone.",2,2026-02-10 18:52:41,6,play_store,Notion,"the service is great, but on other platforms. I use notion mostly for writing down some notes, and the app can't give me a smooth experience on this task. My onscreen keyboard (default Gboard) freaks out when I'm typing. Autosuggestion is not working half of the time, uppercase letters flash every few seconds, some symbols are not registering when I press on them. It makes notion pretty unusable for writing something down on the phone."
"I love the new AI Meeting Notes, but there is a major issue for international users. When I speak Greek, I can see the AI transcribing it perfectly in Greek for a few seconds. However, because Greek isn't ""officially"" in the settings, Notion then auto-translates it into English. Please add a ""Preserve Original Language"" toggle! The engine clearly supports more languages than the settings allow. If we could just stop the auto-translation, this would be a 5-star tool for everyone!",3,2026-02-08 15:53:56,10,play_store,Notion,"I love the new AI Meeting Notes, but there is a major issue for international users. When I speak Greek, I can see the AI transcribing it perfectly in Greek for a few seconds. However, because Greek isn't ""officially"" in the settings, Notion then auto-translates it into English. Please add a ""Preserve Original Language"" toggle! The engine clearly supports more languages than the settings allow. If we could just stop the auto-translation, this would be a 5-star tool for everyone!"
"I can't remember the last time an app had frustrated me this much. Selecting a function & formatting takes FOREVER. No option to keep source formatting, You have to redo it. Is Rearranging a page is a nightmare; even bullet lists often only move per bullet. You can't highlight & change font size. Essentially no AI functions for free users. speech to text messes up on purpose when using outside software. Notion Desktop is much easier to use. Sticking around for the user-made templates, for now.",2,2026-04-04 08:19:04,43,play_store,Notion,"I can't remember the last time an app had frustrated me this much. Selecting a function & formatting takes FOREVER. No option to keep source formatting, You have to redo it. Is Rearranging a page is a nightmare; even bullet lists often only move per bullet. You can't highlight & change font size. Essentially no AI functions for free users. speech to text messes up on purpose when using outside software. Notion Desktop is much easier to use. Sticking around for the user-made templates, for now."
"Notion keeps logging me out. Every few hours. From what many other users say, the problem has been there for six years at least. The bug makes this otherwise great product (I found no adequate replacement so far) very close to unusable for daily planning and note-taking purposes.",3,2026-03-22 20:14:58,1,play_store,Notion,"Notion keeps logging me out. Every few hours. From what many other users say, the problem has been there for six years at least. The bug makes this otherwise great product (I found no adequate replacement so far) very close to unusable for daily planning and note-taking purposes."
"From 5 to 3 Stars 😢 The recent update changed the bottom toolbar (search, ai, create new button) is an absolute UX Desaster, it's messy, no visual hierarchy. And using the AI feature from the new bar is not working anymore, clicking on it, doesn't open the keyboard or what I'm typing is not visible. This totally ruined my workflow! I hope there's a fix very soon.",3,2026-03-15 12:31:57,2,play_store,Notion,"From 5 to 3 Stars 😢 The recent update changed the bottom toolbar (search, ai, create new button) is an absolute UX Desaster, it's messy, no visual hierarchy. And using the AI feature from the new bar is not working anymore, clicking on it, doesn't open the keyboard or what I'm typing is not visible. This totally ruined my workflow! I hope there's a fix very soon."
"Great app, infinite possibilities, lots of features. I use this on my phone, my iPad and my desktop. I does take some time to learn it and to understand how utilise it to your use case but it is so rewarding and it makes managing things easier and straightforward, I would advice someone learning it to watch Productive Dude and Red Gregory on YouTube. My only complain is that it isn't as optimised on android and iPad as on the iPhone and the desktop version.",4,2026-03-21 22:49:32,2,play_store,Notion,"Great app, infinite possibilities, lots of features. I use this on my phone, my iPad and my desktop. I does take some time to learn it and to understand how utilise it to your use case but it is so rewarding and it makes managing things easier and straightforward, I would advice someone learning it to watch Productive Dude and Red Gregory on YouTube. My only complain is that it isn't as optimised on android and iPad as on the iPhone and the desktop version."
"This is a wonderful shopping list! I also love their official MCP is easy to install inside of Claude. This is everything Google keep notes wish it was. 10/10 this is my go to shopping list app (yes, I use it as a shopping list tracker + integrate heavily with automated claude workflows to organize my shopping and look up walmart locations).",5,2026-03-17 19:41:50,1,play_store,Notion,"This is a wonderful shopping list! I also love their official MCP is easy to install inside of Claude. This is everything Google keep notes wish it was. 10/10 this is my go to shopping list app (yes, I use it as a shopping list tracker + integrate heavily with automated claude workflows to organize my shopping and look up walmart locations)."
"I'd love to rate it higher but the updates seem to be going backwards. It'd be great if they'd bring back the home button on mobile, it's very clunky to navigate without it. Better user control on the overlay panel would be incredible, some links are never used and ones needed don't have options for. Hoping it improves soon.",3,2026-03-21 11:59:06,3,play_store,Notion,"I'd love to rate it higher but the updates seem to be going backwards. It'd be great if they'd bring back the home button on mobile, it's very clunky to navigate without it. Better user control on the overlay panel would be incredible, some links are never used and ones needed don't have options for. Hoping it improves soon."
"I was looking for a new Notes app & this one's pretty popular so decided to give it a try. I mainly needed an app that would sync with both my phone & laptop, Samsung Notes while a solid 9/10 app doesn't sync well outside its ecosystem. Rating would be higher but one complaint so far is the line spacing between paragraphs or content its too big and theres no way to reduce it everything looks double spaced honestly not happy about it, please fix this. *update i deleted the app",3,2026-03-17 11:12:30,3,play_store,Notion,"I was looking for a new Notes app & this one's pretty popular so decided to give it a try. I mainly needed an app that would sync with both my phone & laptop, Samsung Notes while a solid 9/10 app doesn't sync well outside its ecosystem. Rating would be higher but one complaint so far is the line spacing between paragraphs or content its too big and theres no way to reduce it everything looks double spaced honestly not happy about it, please fix this. *update i deleted the app"
"It's slow. It does not seem to store anything on the phone, meaning it needs internet connections for everything (it must be a web browser in disguise). Lots of connectivity issues even when other apps are working fine. The polar opposite of snappy and responsive.",1,2026-03-18 06:15:20,2,play_store,Notion,"It's slow. It does not seem to store anything on the phone, meaning it needs internet connections for everything (it must be a web browser in disguise). Lots of connectivity issues even when other apps are working fine. The polar opposite of snappy and responsive."
"This whole app has to be rage bait. Who makes a note planner, forces GIANT text size so you can only read 3 or 4 lines on your screen at a time. And then has NO FONT SIZE setting?! A simple feature that has existed for almost 30 years. And this App developer STILL can't figure it out? If you're under the age of 70, this ""note"" app is useless. More scrolling involved than taking or reading notes.",1,2026-04-02 20:09:19,2,play_store,Notion,"This whole app has to be rage bait. Who makes a note planner, forces GIANT text size so you can only read 3 or 4 lines on your screen at a time. And then has NO FONT SIZE setting?! A simple feature that has existed for almost 30 years. And this App developer STILL can't figure it out? If you're under the age of 70, this ""note"" app is useless. More scrolling involved than taking or reading notes."
"This app is genuinely a hot mess. I don't know if it's the bugs or the layout, but it shouldn't so much of a hassle to duplicate a template on mobile. Not to mention, I keep experiencing issues with wanting to use Notion AI. It keeps erasing words as if it ran out of space. And if I leave Notion AI, I almost can't back in until I either wait for the chat bar appears again or if I restart the app. It's just too much to use on mobile.",1,2026-02-01 20:30:57,22,play_store,Notion,"This app is genuinely a hot mess. I don't know if it's the bugs or the layout, but it shouldn't so much of a hassle to duplicate a template on mobile. Not to mention, I keep experiencing issues with wanting to use Notion AI. It keeps erasing words as if it ran out of space. And if I leave Notion AI, I almost can't back in until I either wait for the chat bar appears again or if I restart the app. It's just too much to use on mobile."
I'm going to give it a one cause I duplicate a template set the things I want but the damn app deletes it . turning my handwork into wasted time and again get the template and it deletes everything again cause at the start I throught it was a mistake but is just how the dayum app is and tell me why for a note app it does have an undo button just incase someone makes a mistake and erases something important but noo and a lot of people recommended me this app trash app,1,2026-03-27 13:11:01,0,play_store,Notion,I'm going to give it a one cause I duplicate a template set the things I want but the damn app deletes it . turning my handwork into wasted time and again get the template and it deletes everything again cause at the start I throught it was a mistake but is just how the dayum app is and tell me why for a note app it does have an undo button just incase someone makes a mistake and erases something important but noo and a lot of people recommended me this app trash app
"While the basic application is good (once stripped of its unnecessary AI features, something that only required an email to the developers), the mobile app functions much less consistently — for example, sometimes pictures will simply refuse to load in-line for a while, requiring the user to ""view original"" through the long-press menu — and is missing features from the desktop app, like the ability to navigate pages through header outlines.",3,2026-03-18 13:16:38,1,play_store,Notion,"While the basic application is good (once stripped of its unnecessary AI features, something that only required an email to the developers), the mobile app functions much less consistently — for example, sometimes pictures will simply refuse to load in-line for a while, requiring the user to ""view original"" through the long-press menu — and is missing features from the desktop app, like the ability to navigate pages through header outlines."
"Notion is my go-to app for staying organized. I use it for notes, to-do lists, tasks, important work, bills, and payment tracking — all in one place. Simple, flexible, and super useful.",5,2026-03-24 23:54:54,2,play_store,Notion,"Notion is my go-to app for staying organized. I use it for notes, to-do lists, tasks, important work, bills, and payment tracking — all in one place. Simple, flexible, and super useful."
"A struggle to get use to its unique layout and file allocation methods.. BUT... once you get the hang its a fantastic piece of software. Basically anything you create can become anything. you wouldn't create a word document to then put it into a folder. You create a single entity and it can become a folder, checklist, to do list, anything. Perseverance is key!",5,2026-01-12 16:06:36,22,play_store,Notion,"A struggle to get use to its unique layout and file allocation methods.. BUT... once you get the hang its a fantastic piece of software. Basically anything you create can become anything. you wouldn't create a word document to then put it into a folder. You create a single entity and it can become a folder, checklist, to do list, anything. Perseverance is key!"
"the app on its own is amazing, you can just have your whole life here organized. i liked the ai festure at first but .. it lags a lot and breaks out of nowhere, very painful to pay when that keeps happening.also consumes a lot of phone resources and overheats it sometimes.",3,2026-04-03 22:20:46,0,play_store,Notion,"the app on its own is amazing, you can just have your whole life here organized. i liked the ai festure at first but .. it lags a lot and breaks out of nowhere, very painful to pay when that keeps happening.also consumes a lot of phone resources and overheats it sometimes."
"I love this app. The AI is very informational, while also being able to ask questions in order to ensure it is giving you the best information for your specific need. Also, the notes and templates are great and have greatly increased my ability to stay organized!",5,2026-03-18 03:12:23,1,play_store,Notion,"I love this app. The AI is very informational, while also being able to ask questions in order to ensure it is giving you the best information for your specific need. Also, the notes and templates are great and have greatly increased my ability to stay organized!"
"Notion is great when it works, but every now and then, when you really need it, it's just not showing you your content. Force stop the app, clear cache, check for updates and still you're just left with a sad loading icon.",3,2026-03-13 02:22:42,2,play_store,Notion,"Notion is great when it works, but every now and then, when you really need it, it's just not showing you your content. Force stop the app, clear cache, check for updates and still you're just left with a sad loading icon."
"What makes Notion especially strong is that it connects thinking and execution in the same place. The feature I value most is how notes and tasks live together, because good planning usually depends on turning ideas into action without losing context. That sounds simple, but very few tools handle it well. I appreciate software that helps people stay organized without fragmenting their attention, and Notion does that with unusual flexibility and depth.",5,2026-03-21 04:59:44,1,play_store,Notion,"What makes Notion especially strong is that it connects thinking and execution in the same place. The feature I value most is how notes and tasks live together, because good planning usually depends on turning ideas into action without losing context. That sounds simple, but very few tools handle it well. I appreciate software that helps people stay organized without fragmenting their attention, and Notion does that with unusual flexibility and depth."
"The Pc Version is great but the Mobile version is just useless. So much laggy, feels like a very heavy app. Although the Pc version is great but until the mobile version is not fixed I am not coming back. Eco system is very important for me.",1,2026-03-12 00:08:29,3,play_store,Notion,"The Pc Version is great but the Mobile version is just useless. So much laggy, feels like a very heavy app. Although the Pc version is great but until the mobile version is not fixed I am not coming back. Eco system is very important for me."
"Notion just pushed a silent update to my device, even though auto update was turned off in the Play store. What's up with the silent update that circumvented the Play store settings? Does not look good in my books. EDIT: It's 2026. The new updates have ruined it for tab users, and logging in to the app is impossible now!",1,2026-03-28 08:37:39,2,play_store,Notion,"Notion just pushed a silent update to my device, even though auto update was turned off in the Play store. What's up with the silent update that circumvented the Play store settings? Does not look good in my books. EDIT: It's 2026. The new updates have ruined it for tab users, and logging in to the app is impossible now!"
"This app has become my second brain and awesome assistant in my daily schedule. Linking pages and databases to resurface thoughts, keeping track of books and long forgotten tv shows has been a great boon. This app truly helps to offload, what i once kept in my head and notebooks. keeping it seamless between my phone and desktop. Using this app daily over the past year since 2025 has been a great boon. It does have its issues, but not enough to make me look for anything else.",5,2026-03-10 17:34:20,3,play_store,Notion,"This app has become my second brain and awesome assistant in my daily schedule. Linking pages and databases to resurface thoughts, keeping track of books and long forgotten tv shows has been a great boon. This app truly helps to offload, what i once kept in my head and notebooks. keeping it seamless between my phone and desktop. Using this app daily over the past year since 2025 has been a great boon. It does have its issues, but not enough to make me look for anything else."
"There's too many bugs, like the logo in the login menu is oversized (Google logo, apple logo, all of it). I cannot scroll down, and sometimes the tools are not showing, I tried re-installing it or clearing the data but it doesn't fix it.",2,2026-04-03 10:10:49,1,play_store,Notion,"There's too many bugs, like the logo in the login menu is oversized (Google logo, apple logo, all of it). I cannot scroll down, and sometimes the tools are not showing, I tried re-installing it or clearing the data but it doesn't fix it."
