content,score,at,thumbsUpCount,source,app_name,text
"I would like to express my heartfelt gratitude for the exceptional entertainment service that has truly enhanced my experience with productivity and organization. The platform, Notion, stands out for its remarkable ability to seamlessly integrate various functionalities, making it an indispensable tool for managing notes and tasks alike. Its intuitive interface allows for effortless navigation, enabling users to create and organize their thoughts and responsibilities in a visually appealing mann",5,2026-03-06 22:31:41,1,play_store,Notion,"I would like to express my heartfelt gratitude for the exceptional entertainment service that has truly enhanced my experience with productivity and organization. The platform, Notion, stands out for its remarkable ability to seamlessly integrate various functionalities, making it an indispensable tool for managing notes and tasks alike. Its intuitive interface allows for effortless navigation, enabling users to create and organize their thoughts and responsibilities in a visually appealing mann"
"The app is really good. It keeps pushing AI ""solutions"" which is really annoying",4,2026-02-22 17:53:39,0,play_store,Notion,"The app is really good. It keeps pushing AI ""solutions"" which is really annoying"
"It baffles and enrages me at the same time how bad this app is. It's extremely slow and what's worse, it has a bug where a no matter which page you click on, it always opens your most common page. Most of my data is now inaccessible",1,2025-12-26 15:10:24,3,play_store,Notion,"It baffles and enrages me at the same time how bad this app is. It's extremely slow and what's worse, it has a bug where a no matter which page you click on, it always opens your most common page. Most of my data is now inaccessible"
I regret using this for my portfolio They keep making stupid updates all images I uploaded on my portfolio is gone all because they want to put images in some sort of way,1,2026-03-20 01:24:22,0,play_store,Notion,I regret using this for my portfolio They keep making stupid updates all images I uploaded on my portfolio is gone all because they want to put images in some sort of way
"App version needs to be more user friendly, simple and creative",4,2026-03-07 20:47:31,0,play_store,Notion,"App version needs to be more user friendly, simple and creative"
"Excellent All-in-one app. Syncs seamlessly across devices. Requires a bit of learning to use it to its full potential. invest your time in learning the app, reap the rewards of freeing up your time for better use.",5,2025-11-20 09:50:41,4,play_store,Notion,"Excellent All-in-one app. Syncs seamlessly across devices. Requires a bit of learning to use it to its full potential. invest your time in learning the app, reap the rewards of freeing up your time for better use."
"I like it because it makes things easier, can you add, like word search, because it takes a lot of time, when there are too many notes, when there is some kind of word search maybe it can make things a lot easier, hopefully there will be an update for word search",5,2025-11-21 14:40:58,1,play_store,Notion,"I like it because it makes things easier, can you add, like word search, because it takes a lot of time, when there are too many notes, when there is some kind of word search maybe it can make things a lot easier, hopefully there will be an update for word search"
"There is no ""Favorite"" section in Home part in Android app after last update and I hope it's bug cause if this is ""feature"" it's worse idea ever and it will force me to stop using Notion after 3 years of actively using it.",1,2026-02-25 14:26:20,1,play_store,Notion,"There is no ""Favorite"" section in Home part in Android app after last update and I hope it's bug cause if this is ""feature"" it's worse idea ever and it will force me to stop using Notion after 3 years of actively using it."
"incredibly laggy, keeps crashing nonstop. crashes on an ipad aswell. ive been on different wifi networks, ive used it in the browser. ive just tried the desktop version, same issue. practically unusable. crashes nonstop regardless.",1,2025-12-06 18:29:15,2,play_store,Notion,"incredibly laggy, keeps crashing nonstop. crashes on an ipad aswell. ive been on different wifi networks, ive used it in the browser. ive just tried the desktop version, same issue. practically unusable. crashes nonstop regardless."
"The mobile version is terrible. Pages are loading slow, the feedback when you try to do anything is super bad and slow. Nobody would be using the app, if not the great web version. Unimaginable how such app can be produced by the same team.",1,2025-11-21 03:37:14,5,play_store,Notion,"The mobile version is terrible. Pages are loading slow, the feedback when you try to do anything is super bad and slow. Nobody would be using the app, if not the great web version. Unimaginable how such app can be produced by the same team."
"Notion is an excellent all-in-one app for notes, tasks, planning, and productivity. I use it daily to organize my studies, goals, and routines in one place. The flexibility, clean interface, and powerful features make planning simple and effective. It feels like a second brain. Highly recommended for students and professionals.",5,2025-12-20 18:05:44,8,play_store,Notion,"Notion is an excellent all-in-one app for notes, tasks, planning, and productivity. I use it daily to organize my studies, goals, and routines in one place. The flexibility, clean interface, and powerful features make planning simple and effective. It feels like a second brain. Highly recommended for students and professionals."
"Notion on tablet/desktop is better. On mobile, you can't do or see columns even on landscape mode. Slash command is gone, you can't type :emoji: to add an emoji, and the ""find"" fails to actually locate where the word you're searching for is and instead just redirect you to the page the word is found in. Other than that, there's no issue for me. App's great, but the mobile version can do better than this imo.",4,2025-12-03 07:51:27,3,play_store,Notion,"Notion on tablet/desktop is better. On mobile, you can't do or see columns even on landscape mode. Slash command is gone, you can't type :emoji: to add an emoji, and the ""find"" fails to actually locate where the word you're searching for is and instead just redirect you to the page the word is found in. Other than that, there's no issue for me. App's great, but the mobile version can do better than this imo."
"Do not sign up for annual billing, unless you happen to be an expert on their billing process! while just getting started with the app, I added a friend to collaborate on a project. Surprise! My annual bill was doubled!",1,2025-12-18 04:53:30,2,play_store,Notion,"Do not sign up for annual billing, unless you happen to be an expert on their billing process! while just getting started with the app, I added a friend to collaborate on a project. Surprise! My annual bill was doubled!"
First it was good but after the update I am unable to load or open my uploaded photos ...please fix this issue,1,2026-02-27 06:45:39,2,play_store,Notion,First it was good but after the update I am unable to load or open my uploaded photos ...please fix this issue
Connection is a lot better. Doesn't lag as much. Very intuitive. A bit annoying when you type '@' then it slides your screen all the way down. But it's cross platform so super convenient and the templates are amazing.,5,2025-10-19 04:35:55,2,play_store,Notion,Connection is a lot better. Doesn't lag as much. Very intuitive. A bit annoying when you type '@' then it slides your screen all the way down. But it's cross platform so super convenient and the templates are amazing.
"Edit: recently pressing the back button on my devices not only hides the on screen keyboard but also takes me back to a previous page that I accessed before the current page. This is kind of annoying, I just want to hide the keyboard so I can see the whole page easily. Please fix this. thank you.",3,2025-12-13 08:08:57,27,play_store,Notion,"Edit: recently pressing the back button on my devices not only hides the on screen keyboard but also takes me back to a previous page that I accessed before the current page. This is kind of annoying, I just want to hide the keyboard so I can see the whole page easily. Please fix this. thank you."
"I have multiple notes in my notebook. But no matter what note I open. It only opens one especific note, very strange . Works fine in browser though. Have tried clearing cache and all data, which temporarily solved the issue but it reappeared again now. Will give full star if the problem gets solved in next update.",3,2025-10-24 07:35:00,0,play_store,Notion,"I have multiple notes in my notebook. But no matter what note I open. It only opens one especific note, very strange . Works fine in browser though. Have tried clearing cache and all data, which temporarily solved the issue but it reappeared again now. Will give full star if the problem gets solved in next update."
"amazing Manager, a little confusing but once you learn it's amazing.",5,2026-03-22 22:17:56,0,play_store,Notion,"amazing Manager, a little confusing but once you learn it's amazing."
"$10B Valuation Not Because of the App. Great product, awesome on desktop, fantastic features. The app is buggy clunky app makes for an unpleasant UX",3,2026-03-23 10:55:02,0,play_store,Notion,"$10B Valuation Not Because of the App. Great product, awesome on desktop, fantastic features. The app is buggy clunky app makes for an unpleasant UX"
"The new update made it so no images work, and no images can be uploaded either",1,2026-03-18 07:04:06,2,play_store,Notion,"The new update made it so no images work, and no images can be uploaded either"
everyday driver. ai and notes. also excellent transcription voice recognition,5,2026-03-29 19:04:29,0,play_store,Notion,everyday driver. ai and notes. also excellent transcription voice recognition
This is very good - it provides everything i need in a note taking app.,5,2026-03-20 07:17:34,0,play_store,Notion,This is very good - it provides everything i need in a note taking app.
terrible update. i cant insert an image. only asking ai is available. why do i need to talk to ai. please stop pushing this AI slop,1,2026-03-14 11:08:43,1,play_store,Notion,terrible update. i cant insert an image. only asking ai is available. why do i need to talk to ai. please stop pushing this AI slop
The Pc Version is great but the Mobile version is just useless.,2,2026-03-23 13:02:32,0,play_store,Notion,The Pc Version is great but the Mobile version is just useless.
"This system offers a wide range of use cases, with significant adaptability and capabilities. Ongoing improvements are continuously enhancing the application and user experience! Great work from the Notion Team😎",5,2026-03-16 22:17:59,0,play_store,Notion,"This system offers a wide range of use cases, with significant adaptability and capabilities. Ongoing improvements are continuously enhancing the application and user experience! Great work from the Notion Team😎"
I think the app is good and useful but seems this is too complicated for simple tasks.,5,2026-03-31 18:03:24,0,play_store,Notion,I think the app is good and useful but seems this is too complicated for simple tasks.
Mobile Notion needs an optimization but notion insteads focus on implementing AI features that you need to pay.,1,2026-04-03 00:39:21,1,play_store,Notion,Mobile Notion needs an optimization but notion insteads focus on implementing AI features that you need to pay.
Very bad interface and slow to use on android,1,2026-03-19 20:12:01,0,play_store,Notion,Very bad interface and slow to use on android
"Issues: - Text box triggers Google Password panel, which is annoying. - Ai Chat Session is only one way sync from Web / macOS dmg to mobile phone. A refresh button might needed. Device: Google Pixel 8 Pro Android version: 16 Android security update: March 5, 2026 Notion Version: Latest on March 16, 2026",4,2026-03-25 13:04:53,1,play_store,Notion,"Issues: - Text box triggers Google Password panel, which is annoying. - Ai Chat Session is only one way sync from Web / macOS dmg to mobile phone. A refresh button might needed. Device: Google Pixel 8 Pro Android version: 16 Android security update: March 5, 2026 Notion Version: Latest on March 16, 2026"
New update causes app to crash when opening.,1,2026-03-19 02:46:07,0,play_store,Notion,New update causes app to crash when opening.
Very useful and easy when you understood,5,2026-03-15 07:12:02,0,play_store,Notion,Very useful and easy when you understood
"everything is good and decent but somethings are still missing such as ai responses are limited and didn't get refreshed day by day at least they can make the ai responses limited (only 3 or maybe 5) for each day and gets refreshed every day, clipboard doesn't support, and more options are still missing",3,2025-11-06 07:47:23,2,play_store,Notion,"everything is good and decent but somethings are still missing such as ai responses are limited and didn't get refreshed day by day at least they can make the ai responses limited (only 3 or maybe 5) for each day and gets refreshed every day, clipboard doesn't support, and more options are still missing"
Best app to organize every detail in your life.,5,2026-03-31 22:01:13,0,play_store,Notion,Best app to organize every detail in your life.
app wont even load my notes anymore after adding the stupid AI slop. deleting this wack app. a shame.,1,2026-03-20 20:02:32,1,play_store,Notion,app wont even load my notes anymore after adding the stupid AI slop. deleting this wack app. a shame.
Notion AI is great. Notion is a great operating system.,5,2026-03-15 10:10:08,0,play_store,Notion,Notion AI is great. Notion is a great operating system.
"Awful! Why om earth did you make it so damn demanding? My phone is by no means slow; it runs heavy apps and games just fine. However, whoever designed Notion decided to make it impossible to run on anything short of an Iphone Max! I'll never use this thing again.",1,2026-01-01 05:52:08,6,play_store,Notion,"Awful! Why om earth did you make it so damn demanding? My phone is by no means slow; it runs heavy apps and games just fine. However, whoever designed Notion decided to make it impossible to run on anything short of an Iphone Max! I'll never use this thing again."
"Great app; but the fact it constantly updates is a minor annoyance, because it makes the program open on its own every time I turn on my laptop. Would appreciate if they fixed a bunch of things all at once rather than in little increments.",4,2025-12-09 04:48:58,3,play_store,Notion,"Great app; but the fact it constantly updates is a minor annoyance, because it makes the program open on its own every time I turn on my laptop. Would appreciate if they fixed a bunch of things all at once rather than in little increments."
"Used it for only about 15 minutes and I already love it. I copied and pasted my notes from the notes app into this app and had ai organize it for me, which was so helpful. It seems this app is free, too, which is awesome. 5 stars from me.",5,2025-10-18 12:44:33,0,play_store,Notion,"Used it for only about 15 minutes and I already love it. I copied and pasted my notes from the notes app into this app and had ai organize it for me, which was so helpful. It seems this app is free, too, which is awesome. 5 stars from me."
"I love Notion, but this app has become almost unusable. Pages won't open. Sub-tasks won't open. It freezes all the time. It really makes me angry because I pay for the Business tier and can't even use the mobile version.",2,2025-12-21 07:33:12,3,play_store,Notion,"I love Notion, but this app has become almost unusable. Pages won't open. Sub-tasks won't open. It freezes all the time. It really makes me angry because I pay for the Business tier and can't even use the mobile version."
The app is amazing. You can either use it for organizing business stuff or personal stuff like a journal. The only bad thing I have to say is that the app is very laggy on mobile version. Besides that it's 10/10,3,2025-12-29 03:21:13,3,play_store,Notion,The app is amazing. You can either use it for organizing business stuff or personal stuff like a journal. The only bad thing I have to say is that the app is very laggy on mobile version. Besides that it's 10/10
"Notion is for individuals, businesses implement.\n Plans.\n And goals.\n For success. User friendly wish I would have found it earlier",5,2026-04-03 09:09:13,0,play_store,Notion,"Notion is for individuals, businesses implement.\n Plans.\n And goals.\n For success. User friendly wish I would have found it earlier"
"I don't recommend it for business purposes. But if you want to use it for free time stuff it's really useful. I use it to write my dream journal and I like how in the document you can make several pages so it makes it easier to look through. But I can't even count how many times the end of my sentences or a whole paragraph was deleted even after the little loading thing ""saved it"". They really need to add a save button bc it's so annoying that you have to write everything down again.",3,2024-04-14 13:48:41,2,play_store,Notion,"I don't recommend it for business purposes. But if you want to use it for free time stuff it's really useful. I use it to write my dream journal and I like how in the document you can make several pages so it makes it easier to look through. But I can't even count how many times the end of my sentences or a whole paragraph was deleted even after the little loading thing ""saved it"". They really need to add a save button bc it's so annoying that you have to write everything down again."
"I love notion. I use it on my desktop with the app, at work in the browser and on mobile. My major criticism of the mobile app is the widgets are mostly useless and only serve as a way to open the app itself. For example, if you choose the Favorites or Recents widgets it only shows you the page's title, with no way to expand the page to view any of the contents. At most this might save you a single click of the screen, but in function, provides no useful information. Same with the Page widget.",3,2024-11-25 05:04:13,15,play_store,Notion,"I love notion. I use it on my desktop with the app, at work in the browser and on mobile. My major criticism of the mobile app is the widgets are mostly useless and only serve as a way to open the app itself. For example, if you choose the Favorites or Recents widgets it only shows you the page's title, with no way to expand the page to view any of the contents. At most this might save you a single click of the screen, but in function, provides no useful information. Same with the Page widget."
"life changing, so helpful to stay organised and so flexible, so you can make your pages look whatever way you like, or there are plenty of good, free templates if you don't want to take the time to learn to create your own. I use this every day for so many aspects of my life and I love it. My only complaints about it is the fact that you can't change text size or alignment. Also, there are no custom colours, so your limited with the colour themes of your pages. but still an amazing app!!!!!!",5,2024-09-12 15:31:20,74,play_store,Notion,"life changing, so helpful to stay organised and so flexible, so you can make your pages look whatever way you like, or there are plenty of good, free templates if you don't want to take the time to learn to create your own. I use this every day for so many aspects of my life and I love it. My only complaints about it is the fact that you can't change text size or alignment. Also, there are no custom colours, so your limited with the colour themes of your pages. but still an amazing app!!!!!!"
"I have used this app for 2 years I thing, and I really recommended it, it's so great. It better point is that there's so many tools and connections for other apps to organize all areas of your life. In addition, you can use it in anywhere, laptop, cellphone and tablet. There was one bad point of this app, it didn't a calendar that connect other calendars, like Google calendar for example, however, now there is, so you can connect all compromise that you have in a unique app.",5,2024-06-14 02:59:32,49,play_store,Notion,"I have used this app for 2 years I thing, and I really recommended it, it's so great. It better point is that there's so many tools and connections for other apps to organize all areas of your life. In addition, you can use it in anywhere, laptop, cellphone and tablet. There was one bad point of this app, it didn't a calendar that connect other calendars, like Google calendar for example, however, now there is, so you can connect all compromise that you have in a unique app."
"Still pretty new to Notion, but I'm a huge fan already! It's by FAR the only app of its kind that checks all the boxes for me. Nothing else comes close. The ONLY THING I don't like is that I can't customize the fonts as much as I'd like to. I do like the options that are there, but given the ability I'd definely choose other fonts. Honestly, the other features and overall experience almost make up for it completely.",4,2024-07-20 08:13:53,10,play_store,Notion,"Still pretty new to Notion, but I'm a huge fan already! It's by FAR the only app of its kind that checks all the boxes for me. Nothing else comes close. The ONLY THING I don't like is that I can't customize the fonts as much as I'd like to. I do like the options that are there, but given the ability I'd definely choose other fonts. Honestly, the other features and overall experience almost make up for it completely."
"I use this app a lot, and it's great, but there are certain things that need fixing/upgrading... • I'm unable to copy/paste when I highlight words. Nothing happens. It depends on the content, in a paragraph, it does, but when it's a bullet point, it doesn't work. • I want to select more than one thing at a time, like more than one paragraph or another point, but can't. Only one thing at a time can be selected. • Unable to delete photo they've been added to a page",4,2021-11-24 09:51:36,20,play_store,Notion,"I use this app a lot, and it's great, but there are certain things that need fixing/upgrading... • I'm unable to copy/paste when I highlight words. Nothing happens. It depends on the content, in a paragraph, it does, but when it's a bullet point, it doesn't work. • I want to select more than one thing at a time, like more than one paragraph or another point, but can't. Only one thing at a time can be selected. • Unable to delete photo they've been added to a page"
"Don't put all your eggs in one basket. Rubbish experience especially for typing. I highly suggest one look for other apps for a more seamless experience especially when it comes to typing. For a all-in-one app, the typing (Android in this case) is a nightmare. I'm having a hard time now having to copy texts. It's not intuitive at all. Such a disappointment.",1,2023-09-13 15:01:01,33,play_store,Notion,"Don't put all your eggs in one basket. Rubbish experience especially for typing. I highly suggest one look for other apps for a more seamless experience especially when it comes to typing. For a all-in-one app, the typing (Android in this case) is a nightmare. I'm having a hard time now having to copy texts. It's not intuitive at all. Such a disappointment."
"I'm absolutely in love with Notion, I use it for almost everything in my life, and one of those uses is writing. I found a problem, though, and that is that paragraph indentation doesn't exists, not even in pc, and by pressing the TAB key, what's indented is the whole block. For writing, that's kind of a problem, as it's very useful to have indentation support both for usefulness and aesthetics, without having to press space key five times.",4,2020-12-20 04:49:33,110,play_store,Notion,"I'm absolutely in love with Notion, I use it for almost everything in my life, and one of those uses is writing. I found a problem, though, and that is that paragraph indentation doesn't exists, not even in pc, and by pressing the TAB key, what's indented is the whole block. For writing, that's kind of a problem, as it's very useful to have indentation support both for usefulness and aesthetics, without having to press space key five times."
"I love love notion, it's taskmaster and really great been using it since highschool to college and I can say I'm more organised than ever, it's easy to use (you can watch a lot of tutorials if you don't)and it's also uniquely aesthetic. One features about the app is the new version ai even though I can only use it few trial because I don't have the premium version, it's great that there's no big gap between the free version and the premium version(not even the price). So everyone try it out!💕",5,2025-01-14 17:25:36,282,play_store,Notion,"I love love notion, it's taskmaster and really great been using it since highschool to college and I can say I'm more organised than ever, it's easy to use (you can watch a lot of tutorials if you don't)and it's also uniquely aesthetic. One features about the app is the new version ai even though I can only use it few trial because I don't have the premium version, it's great that there's no big gap between the free version and the premium version(not even the price). So everyone try it out!💕"
