content,score,at,thumbsUpCount,source,app_name,text,clean_text,sentiment_compound,sentiment_positive,sentiment_negative,sentiment_label,cluster_id,topic_category
"I love the new AI Meeting Notes, but there is a major issue for international users. When I speak Greek, I can see the AI transcribing it perfectly in Greek for a few seconds. However, because Greek isn't ""officially"" in the settings, Notion then auto-translates it into English. Please add a ""Preserve Original Language"" toggle! The engine clearly supports more languages than the settings allow. If we could just stop the auto-translation, this would be a 5-star tool for everyone!",3,2026-02-08 15:53:56,10,play_store,Notion,"I love the new AI Meeting Notes, but there is a major issue for international users. When I speak Greek, I can see the AI transcribing it perfectly in Greek for a few seconds. However, because Greek isn't ""officially"" in the settings, Notion then auto-translates it into English. Please add a ""Preserve Original Language"" toggle! The engine clearly supports more languages than the settings allow. If we could just stop the auto-translation, this would be a 5-star tool for everyone!",i love the new ai meeting notes but there is a major issue for international users when i speak greek i can see the ai transcribing it perfectly in greek for a few seconds however because greek isn't officially in the settings notion then auto-translates it into english please add a preserve original language toggle the engine clearly supports more languages than the settings allow if we could just stop the auto-translation this would be a 5-star tool for everyone,0.9668,0.239,0.028,positive,5,Features
"I can't remember the last time an app had frustrated me this much. Selecting a function & formatting takes FOREVER. No option to keep source formatting, You have to redo it. Is Rearranging a page is a nightmare; even bullet lists often only move per bullet. You can't highlight & change font size. Essentially no AI functions for free users. speech to text messes up on purpose when using outside software. Notion Desktop is much easier to use. Sticking around for the user-made templates, for now.",2,2026-04-04 08:19:04,43,play_store,Notion,"I can't remember the last time an app had frustrated me this much. Selecting a function & formatting takes FOREVER. No option to keep source formatting, You have to redo it. Is Rearranging a page is a nightmare; even bullet lists often only move per bullet. You can't highlight & change font size. Essentially no AI functions for free users. speech to text messes up on purpose when using outside software. Notion Desktop is much easier to use. Sticking around for the user-made templates, for now.",i can't remember the last time an app had frustrated me this much selecting a function formatting takes forever no option to keep source formatting you have to redo it is rearranging a page is a nightmare even bullet lists often only move per bullet you can't highlight change font size essentially no ai functions for free users speech to text messes up on purpose when using outside software notion desktop is much easier to use sticking around for the user-made templates for now,-0.409,0.065,0.105,negative,1,Features
"Notion keeps logging me out. Every few hours. From what many other users say, the problem has been there for six years at least. The bug makes this otherwise great product (I found no adequate replacement so far) very close to unusable for daily planning and note-taking purposes.",3,2026-03-22 20:14:58,1,play_store,Notion,"Notion keeps logging me out. Every few hours. From what many other users say, the problem has been there for six years at least. The bug makes this otherwise great product (I found no adequate replacement so far) very close to unusable for daily planning and note-taking purposes.",notion keeps logging me out every few hours from what many other users say the problem has been there for six years at least the bug makes this otherwise great product i found no adequate replacement so far very close to unusable for daily planning and note-taking purposes,0.1862,0.077,0.082,positive,4,Other
"From 5 to 3 Stars 😢 The recent update changed the bottom toolbar (search, ai, create new button) is an absolute UX Desaster, it's messy, no visual hierarchy. And using the AI feature from the new bar is not working anymore, clicking on it, doesn't open the keyboard or what I'm typing is not visible. This totally ruined my workflow! I hope there's a fix very soon.",3,2026-03-15 12:31:57,2,play_store,Notion,"From 5 to 3 Stars 😢 The recent update changed the bottom toolbar (search, ai, create new button) is an absolute UX Desaster, it's messy, no visual hierarchy. And using the AI feature from the new bar is not working anymore, clicking on it, doesn't open the keyboard or what I'm typing is not visible. This totally ruined my workflow! I hope there's a fix very soon.",from 5 to 3 stars the recent update changed the bottom toolbar search ai create new button is an absolute ux desaster it's messy no visual hierarchy and using the ai feature from the new bar is not working anymore clicking on it doesn't open the keyboard or what i'm typing is not visible this totally ruined my workflow i hope there's a fix very soon,-0.4754,0.067,0.109,negative,5,Features
"Great app, infinite possibilities, lots of features. I use this on my phone, my iPad and my desktop. I does take some time to learn it and to understand how utilise it to your use case but it is so rewarding and it makes managing things easier and straightforward, I would advice someone learning it to watch Productive Dude and Red Gregory on YouTube. My only complain is that it isn't as optimised on android and iPad as on the iPhone and the desktop version.",4,2026-03-21 22:49:32,2,play_store,Notion,"Great app, infinite possibilities, lots of features. I use this on my phone, my iPad and my desktop. I does take some time to learn it and to understand how utilise it to your use case but it is so rewarding and it makes managing things easier and straightforward, I would advice someone learning it to watch Productive Dude and Red Gregory on YouTube. My only complain is that it isn't as optimised on android and iPad as on the iPhone and the desktop version.",great app infinite possibilities lots of features i use this on my phone my ipad and my desktop i does take some time to learn it and to understand how utilise it to your use case but it is so rewarding and it makes managing things easier and straightforward i would advice someone learning it to watch productive dude and red gregory on youtube my only complain is that it isn't as optimised on android and ipad as on the iphone and the desktop version,0.7999,0.125,0.062,positive,1,Features
"This is a wonderful shopping list! I also love their official MCP is easy to install inside of Claude. This is everything Google keep notes wish it was. 10/10 this is my go to shopping list app (yes, I use it as a shopping list tracker + integrate heavily with automated claude workflows to organize my shopping and look up walmart locations).",5,2026-03-17 19:41:50,1,play_store,Notion,"This is a wonderful shopping list! I also love their official MCP is easy to install inside of Claude. This is everything Google keep notes wish it was. 10/10 this is my go to shopping list app (yes, I use it as a shopping list tracker + integrate heavily with automated claude workflows to organize my shopping and look up walmart locations).",this is a wonderful shopping list i also love their official mcp is easy to install inside of claude this is everything google keep notes wish it was 10 10 this is my go to shopping list app yes i use it as a shopping list tracker integrate heavily with automated claude workflows to organize my shopping and look up walmart locations,0.9451,0.221,0.0,positive,1,Features
"I'd love to rate it higher but the updates seem to be going backwards. It'd be great if they'd bring back the home button on mobile, it's very clunky to navigate without it. Better user control on the overlay panel would be incredible, some links are never used and ones needed don't have options for. Hoping it improves soon.",3,2026-03-21 11:59:06,3,play_store,Notion,"I'd love to rate it higher but the updates seem to be going backwards. It'd be great if they'd bring back the home button on mobile, it's very clunky to navigate without it. Better user control on the overlay panel would be incredible, some links are never used and ones needed don't have options for. Hoping it improves soon.",i'd love to rate it higher but the updates seem to be going backwards it'd be great if they'd bring back the home button on mobile it's very clunky to navigate without it better user control on the overlay panel would be incredible some links are never used and ones needed don't have options for hoping it improves soon,0.9266,0.215,0.043,positive,1,Features
"I was looking for a new Notes app & this one's pretty popular so decided to give it a try. I mainly needed an app that would sync with both my phone & laptop, Samsung Notes while a solid 9/10 app doesn't sync well outside its ecosystem. Rating would be higher but one complaint so far is the line spacing between paragraphs or content its too big and theres no way to reduce it everything looks double spaced honestly not happy about it, please fix this. *update i deleted the app",3,2026-03-17 11:12:30,3,play_store,Notion,"I was looking for a new Notes app & this one's pretty popular so decided to give it a try. I mainly needed an app that would sync with both my phone & laptop, Samsung Notes while a solid 9/10 app doesn't sync well outside its ecosystem. Rating would be higher but one complaint so far is the line spacing between paragraphs or content its too big and theres no way to reduce it everything looks double spaced honestly not happy about it, please fix this. *update i deleted the app",i was looking for a new notes app this one's pretty popular so decided to give it a try i mainly needed an app that would sync with both my phone laptop samsung notes while a solid 9 10 app doesn't sync well outside its ecosystem rating would be higher but one complaint so far is the line spacing between paragraphs or content its too big and theres no way to reduce it everything looks double spaced honestly not happy about it please fix this update i deleted the app,0.0634,0.118,0.106,positive,3,Bugs & crashes
"It's slow. It does not seem to store anything on the phone, meaning it needs internet connections for everything (it must be a web browser in disguise). Lots of connectivity issues even when other apps are working fine. The polar opposite of snappy and responsive.",1,2026-03-18 06:15:20,2,play_store,Notion,"It's slow. It does not seem to store anything on the phone, meaning it needs internet connections for everything (it must be a web browser in disguise). Lots of connectivity issues even when other apps are working fine. The polar opposite of snappy and responsive.",it's slow it does not seem to store anything on the phone meaning it needs internet connections for everything it must be a web browser in disguise lots of connectivity issues even when other apps are working fine the polar opposite of snappy and responsive,0.3182,0.089,0.041,positive,0,Other
"This whole app has to be rage bait. Who makes a note planner, forces GIANT text size so you can only read 3 or 4 lines on your screen at a time. And then has NO FONT SIZE setting?! A simple feature that has existed for almost 30 years. And this App developer STILL can't figure it out? If you're under the age of 70, this ""note"" app is useless. More scrolling involved than taking or reading notes.",1,2026-04-02 20:09:19,2,play_store,Notion,"This whole app has to be rage bait. Who makes a note planner, forces GIANT text size so you can only read 3 or 4 lines on your screen at a time. And then has NO FONT SIZE setting?! A simple feature that has existed for almost 30 years. And this App developer STILL can't figure it out? If you're under the age of 70, this ""note"" app is useless. More scrolling involved than taking or reading notes.",this whole app has to be rage bait who makes a note planner forces giant text size so you can only read 3 or 4 lines on your screen at a time and then has no font size setting a simple feature that has existed for almost 30 years and this app developer still can't figure it out if you're under the age of 70 this note app is useless more scrolling involved than taking or reading notes,-0.8225,0.0,0.103,negative,4,Other
"This app is genuinely a hot mess. I don't know if it's the bugs or the layout, but it shouldn't so much of a hassle to duplicate a template on mobile. Not to mention, I keep experiencing issues with wanting to use Notion AI. It keeps erasing words as if it ran out of space. And if I leave Notion AI, I almost can't back in until I either wait for the chat bar appears again or if I restart the app. It's just too much to use on mobile.",1,2026-02-01 20:30:57,22,play_store,Notion,"This app is genuinely a hot mess. I don't know if it's the bugs or the layout, but it shouldn't so much of a hassle to duplicate a template on mobile. Not to mention, I keep experiencing issues with wanting to use Notion AI. It keeps erasing words as if it ran out of space. And if I leave Notion AI, I almost can't back in until I either wait for the chat bar appears again or if I restart the app. It's just too much to use on mobile.",this app is genuinely a hot mess i don't know if it's the bugs or the layout but it shouldn't so much of a hassle to duplicate a template on mobile not to mention i keep experiencing issues with wanting to use notion ai it keeps erasing words as if it ran out of space and if i leave notion ai i almost can't back in until i either wait for the chat bar appears again or if i restart the app it's just too much to use on mobile,-0.2617,0.0,0.033,negative,5,Features
I'm going to give it a one cause I duplicate a template set the things I want but the damn app deletes it . turning my handwork into wasted time and again get the template and it deletes everything again cause at the start I throught it was a mistake but is just how the dayum app is and tell me why for a note app it does have an undo button just incase someone makes a mistake and erases something important but noo and a lot of people recommended me this app trash app,1,2026-03-27 13:11:01,0,play_store,Notion,I'm going to give it a one cause I duplicate a template set the things I want but the damn app deletes it . turning my handwork into wasted time and again get the template and it deletes everything again cause at the start I throught it was a mistake but is just how the dayum app is and tell me why for a note app it does have an undo button just incase someone makes a mistake and erases something important but noo and a lot of people recommended me this app trash app,i'm going to give it a one cause i duplicate a template set the things i want but the damn app deletes it turning my handwork into wasted time and again get the template and it deletes everything again cause at the start i throught it was a mistake but is just how the dayum app is and tell me why for a note app it does have an undo button just incase someone makes a mistake and erases something important but noo and a lot of people recommended me this app trash app,-0.8885,0.052,0.132,negative,4,Other
"While the basic application is good (once stripped of its unnecessary AI features, something that only required an email to the developers), the mobile app functions much less consistently — for example, sometimes pictures will simply refuse to load in-line for a while, requiring the user to ""view original"" through the long-press menu — and is missing features from the desktop app, like the ability to navigate pages through header outlines.",3,2026-03-18 13:16:38,1,play_store,Notion,"While the basic application is good (once stripped of its unnecessary AI features, something that only required an email to the developers), the mobile app functions much less consistently — for example, sometimes pictures will simply refuse to load in-line for a while, requiring the user to ""view original"" through the long-press menu — and is missing features from the desktop app, like the ability to navigate pages through header outlines.",while the basic application is good once stripped of its unnecessary ai features something that only required an email to the developers the mobile app functions much less consistently for example sometimes pictures will simply refuse to load in-line for a while requiring the user to view original through the long-press menu and is missing features from the desktop app like the ability to navigate pages through header outlines,0.6808,0.129,0.057,positive,5,Features
"Notion is my go-to app for staying organized. I use it for notes, to-do lists, tasks, important work, bills, and payment tracking — all in one place. Simple, flexible, and super useful.",5,2026-03-24 23:54:54,2,play_store,Notion,"Notion is my go-to app for staying organized. I use it for notes, to-do lists, tasks, important work, bills, and payment tracking — all in one place. Simple, flexible, and super useful.",notion is my go-to app for staying organized i use it for notes to-do lists tasks important work bills and payment tracking all in one place simple flexible and super useful,0.8591,0.28,0.0,positive,2,UX & design
"A struggle to get use to its unique layout and file allocation methods.. BUT... once you get the hang its a fantastic piece of software. Basically anything you create can become anything. you wouldn't create a word document to then put it into a folder. You create a single entity and it can become a folder, checklist, to do list, anything. Perseverance is key!",5,2026-01-12 16:06:36,22,play_store,Notion,"A struggle to get use to its unique layout and file allocation methods.. BUT... once you get the hang its a fantastic piece of software. Basically anything you create can become anything. you wouldn't create a word document to then put it into a folder. You create a single entity and it can become a folder, checklist, to do list, anything. Perseverance is key!",a struggle to get use to its unique layout and file allocation methods but once you get the hang its a fantastic piece of software basically anything you create can become anything you wouldn't create a word document to then put it into a folder you create a single entity and it can become a folder checklist to do list anything perseverance is key,0.8089,0.14,0.053,positive,1,Features
"the app on its own is amazing, you can just have your whole life here organized. i liked the ai festure at first but .. it lags a lot and breaks out of nowhere, very painful to pay when that keeps happening.also consumes a lot of phone resources and overheats it sometimes.",3,2026-04-03 22:20:46,0,play_store,Notion,"the app on its own is amazing, you can just have your whole life here organized. i liked the ai festure at first but .. it lags a lot and breaks out of nowhere, very painful to pay when that keeps happening.also consumes a lot of phone resources and overheats it sometimes.",the app on its own is amazing you can just have your whole life here organized i liked the ai festure at first but it lags a lot and breaks out of nowhere very painful to pay when that keeps happening also consumes a lot of phone resources and overheats it sometimes,0.3588,0.129,0.087,positive,2,UX & design
"I love this app. The AI is very informational, while also being able to ask questions in order to ensure it is giving you the best information for your specific need. Also, the notes and templates are great and have greatly increased my ability to stay organized!",5,2026-03-18 03:12:23,1,play_store,Notion,"I love this app. The AI is very informational, while also being able to ask questions in order to ensure it is giving you the best information for your specific need. Also, the notes and templates are great and have greatly increased my ability to stay organized!",i love this app the ai is very informational while also being able to ask questions in order to ensure it is giving you the best information for your specific need also the notes and templates are great and have greatly increased my ability to stay organized,0.97,0.36,0.0,positive,5,Features
"Notion is great when it works, but every now and then, when you really need it, it's just not showing you your content. Force stop the app, clear cache, check for updates and still you're just left with a sad loading icon.",3,2026-03-13 02:22:42,2,play_store,Notion,"Notion is great when it works, but every now and then, when you really need it, it's just not showing you your content. Force stop the app, clear cache, check for updates and still you're just left with a sad loading icon.",notion is great when it works but every now and then when you really need it it's just not showing you your content force stop the app clear cache check for updates and still you're just left with a sad loading icon,-0.25,0.117,0.137,negative,3,Bugs & crashes
"What makes Notion especially strong is that it connects thinking and execution in the same place. The feature I value most is how notes and tasks live together, because good planning usually depends on turning ideas into action without losing context. That sounds simple, but very few tools handle it well. I appreciate software that helps people stay organized without fragmenting their attention, and Notion does that with unusual flexibility and depth.",5,2026-03-21 04:59:44,1,play_store,Notion,"What makes Notion especially strong is that it connects thinking and execution in the same place. The feature I value most is how notes and tasks live together, because good planning usually depends on turning ideas into action without losing context. That sounds simple, but very few tools handle it well. I appreciate software that helps people stay organized without fragmenting their attention, and Notion does that with unusual flexibility and depth.",what makes notion especially strong is that it connects thinking and execution in the same place the feature i value most is how notes and tasks live together because good planning usually depends on turning ideas into action without losing context that sounds simple but very few tools handle it well i appreciate software that helps people stay organized without fragmenting their attention and notion does that with unusual flexibility and depth,0.9534,0.24,0.0,positive,4,Other
"The Pc Version is great but the Mobile version is just useless. So much laggy, feels like a very heavy app. Although the Pc version is great but until the mobile version is not fixed I am not coming back. Eco system is very important for me.",1,2026-03-12 00:08:29,3,play_store,Notion,"The Pc Version is great but the Mobile version is just useless. So much laggy, feels like a very heavy app. Although the Pc version is great but until the mobile version is not fixed I am not coming back. Eco system is very important for me.",the pc version is great but the mobile version is just useless so much laggy feels like a very heavy app although the pc version is great but until the mobile version is not fixed i am not coming back eco system is very important for me,0.8857,0.236,0.062,positive,1,Features
"Notion just pushed a silent update to my device, even though auto update was turned off in the Play store. What's up with the silent update that circumvented the Play store settings? Does not look good in my books. EDIT: It's 2026. The new updates have ruined it for tab users, and logging in to the app is impossible now!",1,2026-03-28 08:37:39,2,play_store,Notion,"Notion just pushed a silent update to my device, even though auto update was turned off in the Play store. What's up with the silent update that circumvented the Play store settings? Does not look good in my books. EDIT: It's 2026. The new updates have ruined it for tab users, and logging in to the app is impossible now!",notion just pushed a silent update to my device even though auto update was turned off in the play store what's up with the silent update that circumvented the play store settings does not look good in my books edit it's 2026 the new updates have ruined it for tab users and logging in to the app is impossible now,-0.1793,0.072,0.083,negative,3,Bugs & crashes
