content,score,at,thumbsUpCount,source,app_name,text,clean_text,sentiment_compound,sentiment_positive,sentiment_negative,sentiment_label,cluster_id,topic_category
"Edit: issue still ongoing, I just lost several paragraphs due to the app not saving... It was my favourite app but I can't trust it anymore. // I'm so done with the saving/synchronization problems and losing entire paragraphs while I'm writing! It's so bad, I have to use Google Keep to write/save text (trustful app) and then copy-paste the entire thing into Notion.",1,2025-12-06 04:54:37,12,play_store,Notion,"Edit: issue still ongoing, I just lost several paragraphs due to the app not saving... It was my favourite app but I can't trust it anymore. // I'm so done with the saving/synchronization problems and losing entire paragraphs while I'm writing! It's so bad, I have to use Google Keep to write/save text (trustful app) and then copy-paste the entire thing into Notion.",edit issue still ongoing i just lost several paragraphs due to the app not saving it was my favourite app but i can't trust it anymore i'm so done with the saving synchronization problems and losing entire paragraphs while i'm writing it's so bad i have to use google keep to write save text trustful app and then copy-paste the entire thing into notion,-0.8732,0.101,0.219,negative,0,Other
"The ultimate all-in-one workspace! Notion has completely changed how I organize my life and work. I love that I can have my notes, databases, and project trackers all in one place. The customization is endless—you can make it as simple or as complex as you need. It’s the perfect tool for anyone who loves staying organized and aesthetic.",5,2026-01-14 17:53:58,2,play_store,Notion,"The ultimate all-in-one workspace! Notion has completely changed how I organize my life and work. I love that I can have my notes, databases, and project trackers all in one place. The customization is endless—you can make it as simple or as complex as you need. It’s the perfect tool for anyone who loves staying organized and aesthetic.",the ultimate all-in-one workspace notion has completely changed how i organize my life and work i love that i can have my notes databases and project trackers all in one place the customization is endless you can make it as simple or as complex as you need it s the perfect tool for anyone who loves staying organized and aesthetic,0.9118,0.169,0.0,positive,2,UX & design
"I love this in using it free and so far so good, but I've not got any further than writing individual notes. idk what's going to happen when I string a few notes together and start a story, I'll review as and when I go on. 😉",5,2026-02-26 06:19:22,1,play_store,Notion,"I love this in using it free and so far so good, but I've not got any further than writing individual notes. idk what's going to happen when I string a few notes together and start a story, I'll review as and when I go on. 😉",i love this in using it free and so far so good but i've not got any further than writing individual notes idk what's going to happen when i string a few notes together and start a story i'll review as and when i go on,0.6893,0.143,0.031,positive,4,Other
"I use notion for everything but the app leaves a lot to be desired . it's not the prettiest app, UI needs a LOT of work, but that's also just notion in general. It's also missing some features. I would only use this app to reference material you already have, inputting is an awful experience.",3,2026-02-10 00:19:27,4,play_store,Notion,"I use notion for everything but the app leaves a lot to be desired . it's not the prettiest app, UI needs a LOT of work, but that's also just notion in general. It's also missing some features. I would only use this app to reference material you already have, inputting is an awful experience.",i use notion for everything but the app leaves a lot to be desired it's not the prettiest app ui needs a lot of work but that's also just notion in general it's also missing some features i would only use this app to reference material you already have inputting is an awful experience,-0.8461,0.042,0.17,negative,0,Other
I love it a lot helping me out with organization even though I don't remember organising half the time but still I enjoyed it a lot it's keeping all my notes of my fantasy world and some future notes for some ideas for novels,5,2026-01-23 21:58:14,0,play_store,Notion,I love it a lot helping me out with organization even though I don't remember organising half the time but still I enjoyed it a lot it's keeping all my notes of my fantasy world and some future notes for some ideas for novels,i love it a lot helping me out with organization even though i don't remember organising half the time but still i enjoyed it a lot it's keeping all my notes of my fantasy world and some future notes for some ideas for novels,0.8248,0.174,0.0,positive,2,UX & design
"Currently, this app has been testing my patience on a daily basis. A recent update has made my experience with kanban boards a living hell, every time I try to move a note to a different column it opens up the note's settings. Please for the love of god, find a different way to do this. I beg you.",3,2026-02-17 21:05:53,2,play_store,Notion,"Currently, this app has been testing my patience on a daily basis. A recent update has made my experience with kanban boards a living hell, every time I try to move a note to a different column it opens up the note's settings. Please for the love of god, find a different way to do this. I beg you.",currently this app has been testing my patience on a daily basis a recent update has made my experience with kanban boards a living hell every time i try to move a note to a different column it opens up the note's settings please for the love of god find a different way to do this i beg you,0.4588,0.126,0.067,positive,3,Bugs & crashes
"Significant problems. I'm always frustrated with Notion. Be it sharing in Android, load times, switching between accounts, copying data, auth, etc. Nothing really works well.",1,2026-02-23 21:37:24,1,play_store,Notion,"Significant problems. I'm always frustrated with Notion. Be it sharing in Android, load times, switching between accounts, copying data, auth, etc. Nothing really works well.",significant problems i'm always frustrated with notion be it sharing in android load times switching between accounts copying data auth etc nothing really works well,-0.5454,0.141,0.248,negative,0,Other
"This app has helped me stay organized, and it's easy to use. It's also a great app to write on, it doesn't get erased and stays as is unlike other apps. It also has a lot of functions whether you're an employee, a student, or just want to use it for personal use.",5,2026-02-15 09:00:17,2,play_store,Notion,"This app has helped me stay organized, and it's easy to use. It's also a great app to write on, it doesn't get erased and stays as is unlike other apps. It also has a lot of functions whether you're an employee, a student, or just want to use it for personal use.",this app has helped me stay organized and it's easy to use it's also a great app to write on it doesn't get erased and stays as is unlike other apps it also has a lot of functions whether you're an employee a student or just want to use it for personal use,0.8074,0.142,0.0,positive,1,Features
"I love Notion, but in my samsung galaxy tab s10+ it doesnt work properly. I'm facing issues opening my pages as most times it opens a mobile layout that does nothing when clicking them. I can´t access them. I think it has to do with the DEX mode, that it's not working.",2,2026-03-02 01:22:48,3,play_store,Notion,"I love Notion, but in my samsung galaxy tab s10+ it doesnt work properly. I'm facing issues opening my pages as most times it opens a mobile layout that does nothing when clicking them. I can´t access them. I think it has to do with the DEX mode, that it's not working.",i love notion but in my samsung galaxy tab s10 it doesnt work properly i'm facing issues opening my pages as most times it opens a mobile layout that does nothing when clicking them i can t access them i think it has to do with the dex mode that it's not working,0.3818,0.048,0.0,positive,0,Other
Notion has been my go-to as a freelance graphic designer. it's unfair to restrict my access after a failed subscription and still wants me to pay for the service I never used It's totally unfair,1,2026-02-04 14:17:03,2,play_store,Notion,Notion has been my go-to as a freelance graphic designer. it's unfair to restrict my access after a failed subscription and still wants me to pay for the service I never used It's totally unfair,notion has been my go-to as a freelance graphic designer it's unfair to restrict my access after a failed subscription and still wants me to pay for the service i never used it's totally unfair,-0.8908,0.049,0.307,negative,5,Features
"It's honestly a great app for taking daily notes, I regret having not found this earlier because it's way better than my OS-installed notes application. I use it both on my phone and computer, very great and super user-friendly, definitely recommending it to my friends!",5,2026-02-05 10:28:29,0,play_store,Notion,"It's honestly a great app for taking daily notes, I regret having not found this earlier because it's way better than my OS-installed notes application. I use it both on my phone and computer, very great and super user-friendly, definitely recommending it to my friends!",it's honestly a great app for taking daily notes i regret having not found this earlier because it's way better than my os-installed notes application i use it both on my phone and computer very great and super user-friendly definitely recommending it to my friends,0.9704,0.38,0.044,positive,1,Features
"I LOVE the fact you are allowed to do so many things for free without a limited storage. This app is so organized, that's what I use for my OCs because my handwriting is bad, I don't want my hand to hurt, and I can do it anywhere I want!😼🤩",5,2026-02-21 01:37:47,0,play_store,Notion,"I LOVE the fact you are allowed to do so many things for free without a limited storage. This app is so organized, that's what I use for my OCs because my handwriting is bad, I don't want my hand to hurt, and I can do it anywhere I want!😼🤩",i love the fact you are allowed to do so many things for free without a limited storage this app is so organized that's what i use for my ocs because my handwriting is bad i don't want my hand to hurt and i can do it anywhere i want,-0.0731,0.166,0.17,negative,1,Features
"idk whats going on but won't let me use templates every time I click to use it it shows me the search page no matter what, this really bothered me because I love notion and wanted to use it to plan some big things in my life but I'll have to stick with my terrible phone note app for now until it's fixed.",1,2026-02-16 02:37:09,0,play_store,Notion,"idk whats going on but won't let me use templates every time I click to use it it shows me the search page no matter what, this really bothered me because I love notion and wanted to use it to plan some big things in my life but I'll have to stick with my terrible phone note app for now until it's fixed.",idk whats going on but won't let me use templates every time i click to use it it shows me the search page no matter what this really bothered me because i love notion and wanted to use it to plan some big things in my life but i'll have to stick with my terrible phone note app for now until it's fixed,-0.2618,0.079,0.134,negative,1,Features
Notion app is extremely slow and lagging frequently. I am really annoyed by it.,1,2026-04-02 17:42:13,0,play_store,Notion,Notion app is extremely slow and lagging frequently. I am really annoyed by it.,notion app is extremely slow and lagging frequently i am really annoyed by it,-0.6436,0.0,0.305,negative,0,Other
"I love this app. This is perfect. I switched from Google docs, Google sheets, color notes app to this all in one platform.",5,2026-03-22 19:43:37,0,play_store,Notion,"I love this app. This is perfect. I switched from Google docs, Google sheets, color notes app to this all in one platform.",i love this app this is perfect i switched from google docs google sheets color notes app to this all in one platform,0.836,0.273,0.0,positive,2,UX & design
Simply Upset. Notion Freezes at Splash Screen and won't ever load. The app has been like this since two updates ago. Please Fix this Notion Team.,5,2026-03-18 22:57:15,7,play_store,Notion,Simply Upset. Notion Freezes at Splash Screen and won't ever load. The app has been like this since two updates ago. Please Fix this Notion Team.,simply upset notion freezes at splash screen and won't ever load the app has been like this since two updates ago please fix this notion team,0.2732,0.157,0.121,positive,0,Other
"The app is bugged; it's not letting me edit the property number. When I click ""edit,"" nothing appears, but I can duplicate and delete that property! If you could fix it!",2,2026-02-21 18:43:13,1,play_store,Notion,"The app is bugged; it's not letting me edit the property number. When I click ""edit,"" nothing appears, but I can duplicate and delete that property! If you could fix it!",the app is bugged it's not letting me edit the property number when i click edit nothing appears but i can duplicate and delete that property if you could fix it,0.0387,0.037,0.0,neutral,3,Bugs & crashes
"Just downloaded it and everytime I hit ""go"" the app crashes. All I see is a black screen. Killed the app like 5 times and reopened it to find that nothing is working.",1,2026-03-07 10:53:32,0,play_store,Notion,"Just downloaded it and everytime I hit ""go"" the app crashes. All I see is a black screen. Killed the app like 5 times and reopened it to find that nothing is working.",just downloaded it and everytime i hit go the app crashes all i see is a black screen killed the app like 5 times and reopened it to find that nothing is working,-0.4588,0.066,0.118,negative,0,Other
"this app is really useful, loads fast, easy to understand+ the ai inside is very fast at finding folders for you with just key words, especially when you forget/disorganised things alot. highly recommend",5,2026-03-16 22:45:30,1,play_store,Notion,"this app is really useful, loads fast, easy to understand+ the ai inside is very fast at finding folders for you with just key words, especially when you forget/disorganised things alot. highly recommend",this app is really useful loads fast easy to understand the ai inside is very fast at finding folders for you with just key words especially when you forget disorganised things alot highly recommend,0.7732,0.216,0.053,positive,5,Features
"It's a little hard to get around and figure it out at first. Though I soon got it and I love it. This app is very helpful for people who struggle to study or get things done. I used to procrastinate a lot until I got this app. Thank you, Notion!!!",4,2026-01-28 20:50:09,3,play_store,Notion,"It's a little hard to get around and figure it out at first. Though I soon got it and I love it. This app is very helpful for people who struggle to study or get things done. I used to procrastinate a lot until I got this app. Thank you, Notion!!!",it's a little hard to get around and figure it out at first though i soon got it and i love it this app is very helpful for people who struggle to study or get things done i used to procrastinate a lot until i got this app thank you notion,0.8119,0.165,0.058,positive,1,Features
"Notion widgets are very inefficient, slow , not easy to add to the home screen. Desktop works fine .",3,2026-03-15 02:07:55,5,play_store,Notion,"Notion widgets are very inefficient, slow , not easy to add to the home screen. Desktop works fine .",notion widgets are very inefficient slow not easy to add to the home screen desktop works fine,-0.1546,0.094,0.125,negative,0,Other
"Really dislike the recent update / changes to the Ai tool. The Ai tool is very useful for me, many of the core features were ""improve writing"" and the interaction button with the Ai itself doesn't work anymore.",1,2026-03-11 04:58:24,3,play_store,Notion,"Really dislike the recent update / changes to the Ai tool. The Ai tool is very useful for me, many of the core features were ""improve writing"" and the interaction button with the Ai itself doesn't work anymore.",really dislike the recent update changes to the ai tool the ai tool is very useful for me many of the core features were improve writing and the interaction button with the ai itself doesn't work anymore,0.4939,0.142,0.067,positive,5,Features
this is the best app I have ever seen because it helps me to not do everything which I want through anytime anywhere anything I don't want to sugar coat but it is most good for notes not every time but it also lag or disconnect to the network,5,2026-03-11 14:23:59,2,play_store,Notion,this is the best app I have ever seen because it helps me to not do everything which I want through anytime anywhere anything I don't want to sugar coat but it is most good for notes not every time but it also lag or disconnect to the network,this is the best app i have ever seen because it helps me to not do everything which i want through anytime anywhere anything i don't want to sugar coat but it is most good for notes not every time but it also lag or disconnect to the network,0.6837,0.172,0.074,positive,4,Other
"It is better than Trello and easier to work with than Obsidian. Biggest pro is cross-platform sync and ease of use. If you ever share a workspace with sb, there's an annoying paywall. Easy fix - Settings - People - Remove the other member.",4,2026-01-21 18:01:03,4,play_store,Notion,"It is better than Trello and easier to work with than Obsidian. Biggest pro is cross-platform sync and ease of use. If you ever share a workspace with sb, there's an annoying paywall. Easy fix - Settings - People - Remove the other member.",it is better than trello and easier to work with than obsidian biggest pro is cross-platform sync and ease of use if you ever share a workspace with sb there's an annoying paywall easy fix - settings - people - remove the other member,0.8625,0.246,0.05,positive,2,UX & design
Notion is amazingly flexible and I was able to build a template that really works for the way my brain functions!,5,2026-03-21 18:26:19,2,play_store,Notion,Notion is amazingly flexible and I was able to build a template that really works for the way my brain functions!,notion is amazingly flexible and i was able to build a template that really works for the way my brain functions,0.2944,0.099,0.0,positive,0,Other
this won't work smoothly in android. It only outputs 90hz and ui is very jittery. And every notes keep loading when the app is opening. i mean use cache memory to store them in device this will reduce the need of every time loading,1,2026-02-03 08:12:53,1,play_store,Notion,this won't work smoothly in android. It only outputs 90hz and ui is very jittery. And every notes keep loading when the app is opening. i mean use cache memory to store them in device this will reduce the need of every time loading,this won't work smoothly in android it only outputs 90hz and ui is very jittery and every notes keep loading when the app is opening i mean use cache memory to store them in device this will reduce the need of every time loading,0.0,0.0,0.0,neutral,3,Bugs & crashes
"I do love this app, but I find i use it more for storing information than i do for using it and while reflecting on why, I realised that it is ugly. any tool designed for review or reading also has an attractive font/Ui that makes it comfortable to review. This issue and spell check have been ongoing issues that limit Notion from becoming THE single app, to get the job done. An its not like Notion is Unique anymore, there are growing competitors that permit lots of new capabilities. New fonts?",4,2026-02-21 01:28:21,6,play_store,Notion,"I do love this app, but I find i use it more for storing information than i do for using it and while reflecting on why, I realised that it is ugly. any tool designed for review or reading also has an attractive font/Ui that makes it comfortable to review. This issue and spell check have been ongoing issues that limit Notion from becoming THE single app, to get the job done. An its not like Notion is Unique anymore, there are growing competitors that permit lots of new capabilities. New fonts?",i do love this app but i find i use it more for storing information than i do for using it and while reflecting on why i realised that it is ugly any tool designed for review or reading also has an attractive font ui that makes it comfortable to review this issue and spell check have been ongoing issues that limit notion from becoming the single app to get the job done an its not like notion is unique anymore there are growing competitors that permit lots of new capabilities new fonts,0.7036,0.121,0.066,positive,0,Other
"It seriously has rendering issues. whenever I open a new doc it first shows the content of the past doc, fetching from cache, then shows the content of the current documents.",3,2026-03-20 23:28:22,0,play_store,Notion,"It seriously has rendering issues. whenever I open a new doc it first shows the content of the past doc, fetching from cache, then shows the content of the current documents.",it seriously has rendering issues whenever i open a new doc it first shows the content of the past doc fetching from cache then shows the content of the current documents,-0.1779,0.0,0.054,negative,3,Bugs & crashes
"Tries to be the best with AI and latest technologies, but still couldn't render or fix common LaTeX or KaTeX artifacts when dealing with imports cause you'll have to pay for their slow AI to fix those. 😒",1,2026-03-25 12:02:27,1,play_store,Notion,"Tries to be the best with AI and latest technologies, but still couldn't render or fix common LaTeX or KaTeX artifacts when dealing with imports cause you'll have to pay for their slow AI to fix those. 😒",tries to be the best with ai and latest technologies but still couldn't render or fix common latex or katex artifacts when dealing with imports cause you'll have to pay for their slow ai to fix those,0.25,0.066,0.041,positive,5,Features
There is no tool like Notion.. this really organizes my life in ways I couldn't imagine before. The AI functionality is so game changing to me simply because it has the context of my entire life. Man I wouldn't know what to do without Notion.,5,2026-03-06 01:06:32,0,play_store,Notion,There is no tool like Notion.. this really organizes my life in ways I couldn't imagine before. The AI functionality is so game changing to me simply because it has the context of my entire life. Man I wouldn't know what to do without Notion.,there is no tool like notion this really organizes my life in ways i couldn't imagine before the ai functionality is so game changing to me simply because it has the context of my entire life man i wouldn't know what to do without notion,-0.5122,0.0,0.091,negative,5,Features
"purely awesome, AI helped to create a ledger for use in my prayer group (admittedly it's for my use) to keep track but so good. 6* uhm the sixth star broke the rating which is why you can't see it. 🙄",5,2026-03-03 04:26:15,0,play_store,Notion,"purely awesome, AI helped to create a ledger for use in my prayer group (admittedly it's for my use) to keep track but so good. 6* uhm the sixth star broke the rating which is why you can't see it. 🙄",purely awesome ai helped to create a ledger for use in my prayer group admittedly it's for my use to keep track but so good 6 uhm the sixth star broke the rating which is why you can't see it,0.6867,0.191,0.075,positive,5,Features
"Slow, sluggish, shts the bed when pages get even moderately complex. Now with the latest update they had the brilliant idea to remove favorites from the home screen. I'd rather pay for Obsidian sync than keep dealing with this vibecoded nonsense.",1,2026-02-24 06:41:44,4,play_store,Notion,"Slow, sluggish, shts the bed when pages get even moderately complex. Now with the latest update they had the brilliant idea to remove favorites from the home screen. I'd rather pay for Obsidian sync than keep dealing with this vibecoded nonsense.",slow sluggish shts the bed when pages get even moderately complex now with the latest update they had the brilliant idea to remove favorites from the home screen i'd rather pay for obsidian sync than keep dealing with this vibecoded nonsense,0.2023,0.134,0.138,positive,2,UX & design
"This app has levelled up my productivity. I definitely takes time to set it up, but once you have done to ground work, it is super useful and aesthetic. Would definitely recommend for students trying to get their life in order 👍.",5,2026-03-06 13:41:36,2,play_store,Notion,"This app has levelled up my productivity. I definitely takes time to set it up, but once you have done to ground work, it is super useful and aesthetic. Would definitely recommend for students trying to get their life in order 👍.",this app has levelled up my productivity i definitely takes time to set it up but once you have done to ground work it is super useful and aesthetic would definitely recommend for students trying to get their life in order,0.9575,0.331,0.0,positive,4,Other
"Unbearable, slow and buggy app. Using it is incredibly frustrating, especially on slow internet connection. Offline mode bareky works. Never coming back to this",1,2026-01-24 13:44:51,2,play_store,Notion,"Unbearable, slow and buggy app. Using it is incredibly frustrating, especially on slow internet connection. Offline mode bareky works. Never coming back to this",unbearable slow and buggy app using it is incredibly frustrating especially on slow internet connection offline mode bareky works never coming back to this,-0.5709,0.0,0.176,negative,0,Other
