content,score,at,thumbsUpCount,source,app_name,text
"This app is great for organization and just whatever you need written down. My only complaint is the gap in the lines when you start writing below writing, it doesn't matter but I wish I could change it like I can on computer, and the fact you can't put a ' at the end of things or when you continue typing it deletes the word, I need to write names with 's at the end.. I'd like to add on, the AI features absolutely disgust me. I appreciate they don't pop up unwarranted, but it's still upsetting..",4,2026-02-27 03:17:37,15,play_store,Notion,"This app is great for organization and just whatever you need written down. My only complaint is the gap in the lines when you start writing below writing, it doesn't matter but I wish I could change it like I can on computer, and the fact you can't put a ' at the end of things or when you continue typing it deletes the word, I need to write names with 's at the end.. I'd like to add on, the AI features absolutely disgust me. I appreciate they don't pop up unwarranted, but it's still upsetting.."
"This was a fantastic app and superior alternative to most writing docs until the AI rebrand. And, sure, everything has an AI feature nowadays– that which you don't have to use if you don't wish to. But Notion in particular seems insistent on shoving it down their users throats (for lack of a better term)... Basically, it's far too annoying to put up with. And with no obligation to, I will be searching for a better place to keep my work.",1,2025-09-28 00:42:54,287,play_store,Notion,"This was a fantastic app and superior alternative to most writing docs until the AI rebrand. And, sure, everything has an AI feature nowadays– that which you don't have to use if you don't wish to. But Notion in particular seems insistent on shoving it down their users throats (for lack of a better term)... Basically, it's far too annoying to put up with. And with no obligation to, I will be searching for a better place to keep my work."
"It's great but some thing could be improved. One big example is my chart in notion where I document products, it doesn't let me scroll down the text box to see what I wrote after reaching the a certain word count. so at that point i'm just blindly typing in words and I can't see a single thing until I click out of the text box. To clarify I use notion mainly on my android which I admit is kind of inconvenient since it's mainly used for desktop.",4,2026-03-20 05:52:11,5,play_store,Notion,"It's great but some thing could be improved. One big example is my chart in notion where I document products, it doesn't let me scroll down the text box to see what I wrote after reaching the a certain word count. so at that point i'm just blindly typing in words and I can't see a single thing until I click out of the text box. To clarify I use notion mainly on my android which I admit is kind of inconvenient since it's mainly used for desktop."
"Wish the mobile UI was better. In a database with a Notes column, the notes will spill off of the screen behind the keyboard if it's long enough. Will be typing where I can't see it, behind the keyboard. I have to hold the shift button (on my keyboard on mobile) to make a bunch of empty lines beneath to move the text to where I can see it, & it's finicky because sometimes it'll take enter as me wanting to exit the note. Inserting a hyperlink is also a hassle. But 500 character limit :(",4,2026-03-19 18:40:54,5,play_store,Notion,"Wish the mobile UI was better. In a database with a Notes column, the notes will spill off of the screen behind the keyboard if it's long enough. Will be typing where I can't see it, behind the keyboard. I have to hold the shift button (on my keyboard on mobile) to make a bunch of empty lines beneath to move the text to where I can see it, & it's finicky because sometimes it'll take enter as me wanting to exit the note. Inserting a hyperlink is also a hassle. But 500 character limit :("
"The app version is horrible. I love using Notion for my phone, desktop, and chromebook. *The chromebook version is horrible.* I can never navigate through my main menu. It automatically goes to the most recent page I was working on. The app works just fine in my phone and desktop. But for some reason, it does not work on the chrome book. Also, when I make edits through Chromebook, with my writings, it would automatically deletes the whole section if I press back space. It's awful :(",3,2026-02-16 11:55:56,0,play_store,Notion,"The app version is horrible. I love using Notion for my phone, desktop, and chromebook. *The chromebook version is horrible.* I can never navigate through my main menu. It automatically goes to the most recent page I was working on. The app works just fine in my phone and desktop. But for some reason, it does not work on the chrome book. Also, when I make edits through Chromebook, with my writings, it would automatically deletes the whole section if I press back space. It's awful :("
"it's good in every other way, besides the intrusive ai, can't you at least put it in a different section or have people to toggle it off? I don't like how it's on the bottom like that. I see no point in it and you can't even message it too much anyways, only useful for those who pay. but the app is good regardless, it gets some getting used too but easy once you understand how the controls work.",1,2026-03-22 10:03:52,4,play_store,Notion,"it's good in every other way, besides the intrusive ai, can't you at least put it in a different section or have people to toggle it off? I don't like how it's on the bottom like that. I see no point in it and you can't even message it too much anyways, only useful for those who pay. but the app is good regardless, it gets some getting used too but easy once you understand how the controls work."
"Notion helps me manage every detail of my personal and professional life. It has simplified the process of tracking & accessing everything from my recipes and shopping lists to working on team projects with colleagues. Notion also saved me a lot of money & time as I had previously slugged along with disjointed tools. As I discovered the power of Notion, I was able to cancel subscriptions to Trello, Todoist, Evernote, & other apps. It's a game-changer. Not sure how I ever lived without it!",5,2026-01-28 11:31:35,41,play_store,Notion,"Notion helps me manage every detail of my personal and professional life. It has simplified the process of tracking & accessing everything from my recipes and shopping lists to working on team projects with colleagues. Notion also saved me a lot of money & time as I had previously slugged along with disjointed tools. As I discovered the power of Notion, I was able to cancel subscriptions to Trello, Todoist, Evernote, & other apps. It's a game-changer. Not sure how I ever lived without it!"
"Images aren't showing up in the app on saved notes or new notes on the Samsung S26. Everything works fine on my old phone, just not the new one. Emailed the developers and you end up with a response from their A.I. help desk. Apparently you can't talk to a real person. Now I'm stuck finding a new note app and having to add all of the notes from Notion to a new note app. Very disappointing because I really liked this app.",1,2026-03-19 05:59:00,4,play_store,Notion,"Images aren't showing up in the app on saved notes or new notes on the Samsung S26. Everything works fine on my old phone, just not the new one. Emailed the developers and you end up with a response from their A.I. help desk. Apparently you can't talk to a real person. Now I'm stuck finding a new note app and having to add all of the notes from Notion to a new note app. Very disappointing because I really liked this app."
"The many free templates are a godsend. I use Assignment Tracker and absolutely love it. It's a bit much to learn but over time, you'll become familiar with how to make your own templates. It has really helped me keep track with college. Between this app and 'Structured' (seperate app), it's been so easy to plan when my assignments are due, how urgent, and when I want to work on them. Again, it's a bit confusing to learn and manipulate, but the templates are the real money shots here.",5,2026-02-15 08:32:09,33,play_store,Notion,"The many free templates are a godsend. I use Assignment Tracker and absolutely love it. It's a bit much to learn but over time, you'll become familiar with how to make your own templates. It has really helped me keep track with college. Between this app and 'Structured' (seperate app), it's been so easy to plan when my assignments are due, how urgent, and when I want to work on them. Again, it's a bit confusing to learn and manipulate, but the templates are the real money shots here."
"really solid notes app, perfect for story writing and keeping track of OC lore and such. my main problem is the fact that it is literally impossible to single space lines on mobile. it double spaces by default and there's no way to have it not do that. also, if you tab out for a second to, say, look something up, when you go back to the app, the keyboard doesn't stay if you had it up, which on its own isn't a huge issue, but it also disables bold, italics, etc if you hadn't started typing yet.",4,2026-01-04 09:53:45,31,play_store,Notion,"really solid notes app, perfect for story writing and keeping track of OC lore and such. my main problem is the fact that it is literally impossible to single space lines on mobile. it double spaces by default and there's no way to have it not do that. also, if you tab out for a second to, say, look something up, when you go back to the app, the keyboard doesn't stay if you had it up, which on its own isn't a huge issue, but it also disables bold, italics, etc if you hadn't started typing yet."
"It's the most customizable note app you'll find. However, because of this, it is a tad glitchy. I find when I try to press enter sometimes, it backspaces instead and somehow adds extra letters and just jumbles up what I do and there's not an undo button for some reason.. A tad aggravating.. But it's still worth it for the level of customization that you can't get anywhere else.",4,2025-11-27 21:44:59,30,play_store,Notion,"It's the most customizable note app you'll find. However, because of this, it is a tad glitchy. I find when I try to press enter sometimes, it backspaces instead and somehow adds extra letters and just jumbles up what I do and there's not an undo button for some reason.. A tad aggravating.. But it's still worth it for the level of customization that you can't get anywhere else."
"Okay, I'm in love with this app. I've always found that other productivity note apps were lacking one way or the other, so you've had to download two other apps that can do what the previous couldn't. I was simply searching for a smart checklist app, but notion is way beyond that. It's definitely worth taking the time to learn it, my scattered brain definitely feels more organized and not frustrated anymore.",5,2025-10-24 14:49:05,120,play_store,Notion,"Okay, I'm in love with this app. I've always found that other productivity note apps were lacking one way or the other, so you've had to download two other apps that can do what the previous couldn't. I was simply searching for a smart checklist app, but notion is way beyond that. It's definitely worth taking the time to learn it, my scattered brain definitely feels more organized and not frustrated anymore."
"Folder 📂! Sounds trivial, but necessary for an app like this. I need a simple way to group and organise my work. Folders are excellent for that, and it's crazy that the app doesn't have it. Pages and sub-pages quickly clutter up your workspace and it's annoying. That's the only thing holding me from ditching other notes and word processing apps.",3,2025-11-05 01:03:17,145,play_store,Notion,"Folder 📂! Sounds trivial, but necessary for an app like this. I need a simple way to group and organise my work. Folders are excellent for that, and it's crazy that the app doesn't have it. Pages and sub-pages quickly clutter up your workspace and it's annoying. That's the only thing holding me from ditching other notes and word processing apps."
"I really like notion and find it really useful, so I don't want to give it up, but I run into major issues the Android app. Trying to select a favorite note to switch to right after opening the app sometimes causes a crash. Additionally, sometimes when reopening the app, the note I want will be open but then quickly replaced with a message that says this content doesn't exist, which is really frustrating when I know the note does still exist. I've had to switch back to other tools.",2,2019-04-01 04:51:06,25,play_store,Notion,"I really like notion and find it really useful, so I don't want to give it up, but I run into major issues the Android app. Trying to select a favorite note to switch to right after opening the app sometimes causes a crash. Additionally, sometimes when reopening the app, the note I want will be open but then quickly replaced with a message that says this content doesn't exist, which is really frustrating when I know the note does still exist. I've had to switch back to other tools."
"The app is probably great, but it often logs you out and you have to re-enter your password. When you're in a hurry, I save all my data in another app; it's easier than searching for a long, complex 2FA password. Now Samsung has sent a notification that Notion will be sent to dormant apps due to inactivity. Here's a guide on how to make the app less user-friendly.",1,2025-10-23 14:45:55,11,play_store,Notion,"The app is probably great, but it often logs you out and you have to re-enter your password. When you're in a hurry, I save all my data in another app; it's easier than searching for a long, complex 2FA password. Now Samsung has sent a notification that Notion will be sent to dormant apps due to inactivity. Here's a guide on how to make the app less user-friendly."
"Haven't even used it for a week and I absolutely love it. However, there's a couple things keeping me from a 5-star review. First, I'm left-handed, and that shouldn't make a difference, but I'm accidentally opening the side menu far too often, when I really just want to scroll sideways. Second, I want to see an option that lets you open links and bookmarks in your default browser, instead of a webview that I'm just going to reopen in my main browser anyway.",4,2018-10-09 23:53:47,14,play_store,Notion,"Haven't even used it for a week and I absolutely love it. However, there's a couple things keeping me from a 5-star review. First, I'm left-handed, and that shouldn't make a difference, but I'm accidentally opening the side menu far too often, when I really just want to scroll sideways. Second, I want to see an option that lets you open links and bookmarks in your default browser, instead of a webview that I'm just going to reopen in my main browser anyway."
"The interface looks good and I love the way it's set up. I love the variety of ways to connect notes. But it's difficult to do basic things sometimes. It's complicated to even just select and copy text in your notes on Android. For a Note taking app, that's inexcusable. And it's so distracting! It's a basic task I never have to think about in any other app. So to keep my flow of thoughts going when I'm taking notes, I'll have to find another app. I hope to be notified if this is ever fixed.",2,2024-08-10 23:42:17,28,play_store,Notion,"The interface looks good and I love the way it's set up. I love the variety of ways to connect notes. But it's difficult to do basic things sometimes. It's complicated to even just select and copy text in your notes on Android. For a Note taking app, that's inexcusable. And it's so distracting! It's a basic task I never have to think about in any other app. So to keep my flow of thoughts going when I'm taking notes, I'll have to find another app. I hope to be notified if this is ever fixed."
"So far it's been great. So far, I have only used it for to do list and have yet to explore the entire capabilities. To developers, I would recommend having the ability to increase the font size and select area for Android Widget (favorite items). For checkboxes, please allow the ability to hide checked items. In addition, when retyping an item have it autofill to previous item.",4,2024-02-23 22:20:18,82,play_store,Notion,"So far it's been great. So far, I have only used it for to do list and have yet to explore the entire capabilities. To developers, I would recommend having the ability to increase the font size and select area for Android Widget (favorite items). For checkboxes, please allow the ability to hide checked items. In addition, when retyping an item have it autofill to previous item."
"It's actually a decent note taking app when you are connected to the Internet. But it's is worse than worthless when you are out of cell service and offline like when out of town, or on an airplane, or in the driveway and the Wi-Fi is too weak to work but the phone won't switch to 5G... The app closes repeatedly but will sort-of work for a minute or two and then close and lose your note. I lost a bunch of stuff and it seems that the whole folder is corrupted now... It's a mess.",2,2024-07-18 07:59:34,43,play_store,Notion,"It's actually a decent note taking app when you are connected to the Internet. But it's is worse than worthless when you are out of cell service and offline like when out of town, or on an airplane, or in the driveway and the Wi-Fi is too weak to work but the phone won't switch to 5G... The app closes repeatedly but will sort-of work for a minute or two and then close and lose your note. I lost a bunch of stuff and it seems that the whole folder is corrupted now... It's a mess."
"On desktop Notion is a godsend, but getting anything done in this app is like pulling teeth while on fire it's so finicky and difficult to find what you're looking for. Plus if you leave the app for more than a minute, it puts you back at the homepage, which gets annoying fast if you have long or in-depth pages. Notion is a great program, just not on mobile. Also they need to add a toggle to disable AI integration so bad I'm so tired of seeing it. I straight up just do not care about it.",3,2024-09-14 14:40:09,54,play_store,Notion,"On desktop Notion is a godsend, but getting anything done in this app is like pulling teeth while on fire it's so finicky and difficult to find what you're looking for. Plus if you leave the app for more than a minute, it puts you back at the homepage, which gets annoying fast if you have long or in-depth pages. Notion is a great program, just not on mobile. Also they need to add a toggle to disable AI integration so bad I'm so tired of seeing it. I straight up just do not care about it."
"i have used this app on many platforms for many months and ive noticed that on pc, it's has no issues at all. on mobile, there are a couple things that happen, like a little bit of lagging or words jumping, but thats very minor. on my tablet, its about the same, just slightly different. however, i always see the team making improvements to the app! highly recommend using Notion because of its blend of note taking, organization and aesthetics.",5,2024-05-13 20:52:11,104,play_store,Notion,"i have used this app on many platforms for many months and ive noticed that on pc, it's has no issues at all. on mobile, there are a couple things that happen, like a little bit of lagging or words jumping, but thats very minor. on my tablet, its about the same, just slightly different. however, i always see the team making improvements to the app! highly recommend using Notion because of its blend of note taking, organization and aesthetics."
"Notion's databases are amazing, and I love that you can see the data in multiple ways. Awesome. But, I don't care for the way the handle backlinks - kind of a lazy developer way to do it - and the icon for linked pages is obnoxious, ruining for me an otherwise pretty UI. The biggest thing is that you cannot store the data offline, locally. I work for a Fortune 500 company that doesn't allow info to be stored online by a 3rd party. Users, companies want to own their data. Bad.",3,2022-06-22 10:38:10,40,play_store,Notion,"Notion's databases are amazing, and I love that you can see the data in multiple ways. Awesome. But, I don't care for the way the handle backlinks - kind of a lazy developer way to do it - and the icon for linked pages is obnoxious, ruining for me an otherwise pretty UI. The biggest thing is that you cannot store the data offline, locally. I work for a Fortune 500 company that doesn't allow info to be stored online by a 3rd party. Users, companies want to own their data. Bad."
"This is a fantastic system that can be used for way more than just note-taking! I use it to organize and run my online business and track my life tasks, events & meal planning. When I was in college, it was great for keeping track of assignments, notes, and information, even drafting my thesis paper inside the app instead of Google Docs or Word, which you could do and link or embed. I also keep a list of wishlist items and so much more! This is one of the most used apps on my phone!",5,2024-05-16 20:49:25,88,play_store,Notion,"This is a fantastic system that can be used for way more than just note-taking! I use it to organize and run my online business and track my life tasks, events & meal planning. When I was in college, it was great for keeping track of assignments, notes, and information, even drafting my thesis paper inside the app instead of Google Docs or Word, which you could do and link or embed. I also keep a list of wishlist items and so much more! This is one of the most used apps on my phone!"
"It's really easy to use! It's made writing a breeze, and unlike Google Docs, my works won't be sold to AI companies to train AI writing services. My main pet-peeves are being unable to indent a paragraph -- but that can be easily solved with the space bar; and the use of some AI within the app (they aren't required, I just refuse to use those functions, but I don't personally approve of the use of AI).",5,2024-05-09 00:46:29,59,play_store,Notion,"It's really easy to use! It's made writing a breeze, and unlike Google Docs, my works won't be sold to AI companies to train AI writing services. My main pet-peeves are being unable to indent a paragraph -- but that can be easily solved with the space bar; and the use of some AI within the app (they aren't required, I just refuse to use those functions, but I don't personally approve of the use of AI)."
"I love Notion. I've always had trouble keeping myself organized and keeping appointments. With Notion, I don't miss any appointments, and I can do everything in one place. I think it's great and would recommend it to anyone struggling to keep organized. I also love the share option so others can comment/ read if you chose. I think it's awesome!",5,2025-01-17 23:32:02,25,play_store,Notion,"I love Notion. I've always had trouble keeping myself organized and keeping appointments. With Notion, I don't miss any appointments, and I can do everything in one place. I think it's great and would recommend it to anyone struggling to keep organized. I also love the share option so others can comment/ read if you chose. I think it's awesome!"
"Finding out that Notion didn't have an offline mode was an unpleasant surprise for me. I needed to make an important note, but didn't have reception or WiFi. Ended up just writing in Obsidian. On that note (ha), no other note taking app is missing this critical feature. I started to move my notes to Notion, but now will be moving back away until it has a stable offline mode. It's just not acceptable, especially if you're charging money.",2,2024-08-17 03:37:00,52,play_store,Notion,"Finding out that Notion didn't have an offline mode was an unpleasant surprise for me. I needed to make an important note, but didn't have reception or WiFi. Ended up just writing in Obsidian. On that note (ha), no other note taking app is missing this critical feature. I started to move my notes to Notion, but now will be moving back away until it has a stable offline mode. It's just not acceptable, especially if you're charging money."
"A fine, basic list-making app. It updates quickly and accurately between platforms, which was the main function I was looking for. However, there's no way to print directly from the platform, and you can't change the size or font, can't use bold or italics, and can't do anything about the (sometimes funky) line spacing. Still, it's my go-to list app, and that says something!",3,2025-07-12 00:27:47,25,play_store,Notion,"A fine, basic list-making app. It updates quickly and accurately between platforms, which was the main function I was looking for. However, there's no way to print directly from the platform, and you can't change the size or font, can't use bold or italics, and can't do anything about the (sometimes funky) line spacing. Still, it's my go-to list app, and that says something!"
