content,score,at,thumbsUpCount,source,app_name,text
it's a great app to write a book on your thoughts it's more than a just notebook for notes you can organize your thoughts professionally but there are some issue like it lag too much,4,2026-04-04 18:44:43,0,play_store,Notion,it's a great app to write a book on your thoughts it's more than a just notebook for notes you can organize your thoughts professionally but there are some issue like it lag too much
best app. It was so helpful. I can use same app simultaneously both in my android phone and pc. It also gives offline download option. so it is basically all in one app.,5,2026-03-14 14:47:18,1,play_store,Notion,best app. It was so helpful. I can use same app simultaneously both in my android phone and pc. It also gives offline download option. so it is basically all in one app.
"I use Notion from taking daily notes, journaling, documenting works to planning. It's very useful to keep track of my life.",5,2026-04-05 15:54:28,0,play_store,Notion,"I use Notion from taking daily notes, journaling, documenting works to planning. It's very useful to keep track of my life."
"I would give minus stars if I could. Notion is an amazing service but android app is absolutely the worst app in existence. Every single update brings new bugs, app is constantly broken on the phone.",1,2026-03-23 21:34:37,0,play_store,Notion,"I would give minus stars if I could. Notion is an amazing service but android app is absolutely the worst app in existence. Every single update brings new bugs, app is constantly broken on the phone."
twice now I have not been able to see my photos when going into a folder. Ive restarting my phone more then once. I use this app to make a wiki for my OCS ( original characters) please fix this.,3,2026-03-18 22:24:00,1,play_store,Notion,twice now I have not been able to see my photos when going into a folder. Ive restarting my phone more then once. I use this app to make a wiki for my OCS ( original characters) please fix this.
"versatile even though overwhelmed at first, but it is getting easier as we understand the system and shortcut.",5,2026-03-31 06:47:14,0,play_store,Notion,"versatile even though overwhelmed at first, but it is getting easier as we understand the system and shortcut."
"It works great on laptop, but not on mobile phone. Too slow and feels heavy. I wish notion can replace google keep, but atp, I don't think I will switch.",1,2026-03-15 10:33:45,1,play_store,Notion,"It works great on laptop, but not on mobile phone. Too slow and feels heavy. I wish notion can replace google keep, but atp, I don't think I will switch."
"after the recent update you guys did in March the app is no longer opening for me after I updated it,it just close by itself as soon as I opened it ,how can I get the previous version",3,2026-03-18 13:03:43,0,play_store,Notion,"after the recent update you guys did in March the app is no longer opening for me after I updated it,it just close by itself as soon as I opened it ,how can I get the previous version"
"was good, but they clearly started vibe coding it because it's janky now. full of bugs. constantly have to restart the app to get it to work properly. and all they care about it adding ai features to do everything for you (except it's really bad). shame that this app has fallen so far.",3,2026-04-06 06:58:29,2,play_store,Notion,"was good, but they clearly started vibe coding it because it's janky now. full of bugs. constantly have to restart the app to get it to work properly. and all they care about it adding ai features to do everything for you (except it's really bad). shame that this app has fallen so far."
"I used to always search for productivity apps that suited my preference, but this app offers so many templates and customizations that can turn my dream productivity app into reality",5,2026-03-21 23:03:41,2,play_store,Notion,"I used to always search for productivity apps that suited my preference, but this app offers so many templates and customizations that can turn my dream productivity app into reality"
We still need the home page button so it's easy to leave a document and go back to the home page. it can be added to the lower navigators,4,2026-04-01 11:00:33,0,play_store,Notion,We still need the home page button so it's easy to leave a document and go back to the home page. it can be added to the lower navigators
"Very much recommend for daily use. Keep your notes, keep your studies and keep your knowledge in very decent and mannerd way",5,2026-03-19 10:10:44,0,play_store,Notion,"Very much recommend for daily use. Keep your notes, keep your studies and keep your knowledge in very decent and mannerd way"
"not intuitive and not easy to use for anything that's not one of the ""Notion designed "" templates.",2,2026-04-05 22:39:38,0,play_store,Notion,"not intuitive and not easy to use for anything that's not one of the ""Notion designed "" templates."
"A lot of times properties become uneditable: I click on ""Rename"" or ""Edit Property"" and nothing happens. Also, why it's not possible to freeze the columns on the mobile app? Also, why is it so hard to move columns and properties order?",2,2026-02-22 20:27:30,7,play_store,Notion,"A lot of times properties become uneditable: I click on ""Rename"" or ""Edit Property"" and nothing happens. Also, why it's not possible to freeze the columns on the mobile app? Also, why is it so hard to move columns and properties order?"
"I love notion apps from the beginning, only reason for not giving a 5 star review for it is that it is really hard to work with on phones app especially on android (I assume). [Side note my notion calendar app does not even open on my old as well as new phone both being Samsung]",4,2026-01-30 15:24:20,1,play_store,Notion,"I love notion apps from the beginning, only reason for not giving a 5 star review for it is that it is really hard to work with on phones app especially on android (I assume). [Side note my notion calendar app does not even open on my old as well as new phone both being Samsung]"
"I ADORE Notion. I cant even BEGIN to describe what this app has done for me. its like transferring my brain into a navigational aid. Truly my 2nd brain. One minor glitch is that the widgets (which I love) often just show up blank, randomly. Maybe its something on my side, but doesnt happen with other widgets though. Anyway, the gratitude I feel for the developers and creators being Notion is insurmountable. Thank you! 🫶",5,2026-03-11 15:11:42,2,play_store,Notion,"I ADORE Notion. I cant even BEGIN to describe what this app has done for me. its like transferring my brain into a navigational aid. Truly my 2nd brain. One minor glitch is that the widgets (which I love) often just show up blank, randomly. Maybe its something on my side, but doesnt happen with other widgets though. Anyway, the gratitude I feel for the developers and creators being Notion is insurmountable. Thank you! 🫶"
"The more updates it gets, the worse it gets. none of the pictures I add show up, I updated the app, and still nothing.",1,2026-03-18 16:53:08,1,play_store,Notion,"The more updates it gets, the worse it gets. none of the pictures I add show up, I updated the app, and still nothing."
"Works great. Love how customizable every page can be, with many features to make each page unique. Also love using templates for different types of notes. Excellent app for replacing Evernote. Far more advanced options than it had.",5,2026-03-14 18:26:39,3,play_store,Notion,"Works great. Love how customizable every page can be, with many features to make each page unique. Also love using templates for different types of notes. Excellent app for replacing Evernote. Far more advanced options than it had."
It's been years and it's still laggy/no smooth scrolling. My phone has good specs and I think the problem is within the app. I hope you can fix it. Btw nice UI,3,2026-03-31 16:36:13,0,play_store,Notion,It's been years and it's still laggy/no smooth scrolling. My phone has good specs and I think the problem is within the app. I hope you can fix it. Btw nice UI
"Can collaborate. Can create and insert tables and many other elements. Can sort and pin notes to top. Now, an account can be created with a personal email.",5,2026-03-31 06:26:58,0,play_store,Notion,"Can collaborate. Can create and insert tables and many other elements. Can sort and pin notes to top. Now, an account can be created with a personal email."
"used notion for years, but ever since they started implementing AI, both the app and desktop version have become so slow and clunky and bloated. it takes so long for my databases to load that i can't even use them out of pure frustration. looking for an alternative to notion with no AI BS",1,2026-02-21 08:24:34,2,play_store,Notion,"used notion for years, but ever since they started implementing AI, both the app and desktop version have become so slow and clunky and bloated. it takes so long for my databases to load that i can't even use them out of pure frustration. looking for an alternative to notion with no AI BS"
"i really want to love notion. i tried notion several times over past years but unfortunately it's still painfully slow to load anything about the features. i can only do basic things such as adding page or basic text edits. is it bcs it's android or what idk. the app doesn't seem to work as smooth as i've seen promoted on youtube, on people's apple devices.",3,2026-01-27 10:45:24,1,play_store,Notion,"i really want to love notion. i tried notion several times over past years but unfortunately it's still painfully slow to load anything about the features. i can only do basic things such as adding page or basic text edits. is it bcs it's android or what idk. the app doesn't seem to work as smooth as i've seen promoted on youtube, on people's apple devices."
"How the heck is using the notion app 10 GB in 15 days? I only open it like twice a day to see lists, no embedded video, just texts. Please devs investigate this or explain it.",1,2026-03-21 02:01:54,1,play_store,Notion,"How the heck is using the notion app 10 GB in 15 days? I only open it like twice a day to see lists, no embedded video, just texts. Please devs investigate this or explain it."
"Great app for a multitude of things. I use it for grocery lists, game ideas, my D&D session planner and for character sheets and other stuff. It's pretty simple but has more complex features if ever you want to explore a bit.",5,2026-02-17 21:35:34,2,play_store,Notion,"Great app for a multitude of things. I use it for grocery lists, game ideas, my D&D session planner and for character sheets and other stuff. It's pretty simple but has more complex features if ever you want to explore a bit."
"it's an alright app, easy to use. Although I wish the layout was different and that there were more themes for the app as a whole but it's alr I'm contempt",4,2026-03-22 23:02:13,1,play_store,Notion,"it's an alright app, easy to use. Although I wish the layout was different and that there were more themes for the app as a whole but it's alr I'm contempt"
too chaotic or just a lot to learn for beginners i believe there is useful features in it for advanced people for like knowing how to solve something my daily habit tracker date was starting from December 1 and not the date which was today I asked help from Ai etc but didn't work tbh if it just gave better explanations it could be good or less chaotic or maybe it was too much for a 7th grader like me to understandand I don't if it only occurred to me but the app was slower or bugging sometimes,3,2026-01-30 00:10:19,6,play_store,Notion,too chaotic or just a lot to learn for beginners i believe there is useful features in it for advanced people for like knowing how to solve something my daily habit tracker date was starting from December 1 and not the date which was today I asked help from Ai etc but didn't work tbh if it just gave better explanations it could be good or less chaotic or maybe it was too much for a 7th grader like me to understandand I don't if it only occurred to me but the app was slower or bugging sometimes
"This is a great app that works just as well as the desktop version. however the performance is really bad accessing documents is slow and clunky, also the widgets turn blank anytime they refresh.",4,2026-03-09 22:13:53,1,play_store,Notion,"This is a great app that works just as well as the desktop version. however the performance is really bad accessing documents is slow and clunky, also the widgets turn blank anytime they refresh."
"Was unintuitive however the ai tool was useful, created a full weekly timetable which was working well, however then got deleted and wasnt able to get it back, pretty useless to have a timetable deleted mid way through a routine.",1,2026-03-08 15:13:07,4,play_store,Notion,"Was unintuitive however the ai tool was useful, created a full weekly timetable which was working well, however then got deleted and wasnt able to get it back, pretty useless to have a timetable deleted mid way through a routine."
"Notion is one of the most flexible productivity apps out there. I like how it lets you organize everything—notes, tasks, projects, and ideas—in one place without feeling overwhelming. The interface is clean, and the drag‑and‑drop setup makes it easy to build pages exactly the way you want.",5,2026-02-17 01:50:48,2,play_store,Notion,"Notion is one of the most flexible productivity apps out there. I like how it lets you organize everything—notes, tasks, projects, and ideas—in one place without feeling overwhelming. The interface is clean, and the drag‑and‑drop setup makes it easy to build pages exactly the way you want."
"Edit: issue still ongoing, I just lost several paragraphs due to the app not saving... It was my favourite app but I can't trust it anymore. // I'm so done with the saving/synchronization problems and losing entire paragraphs while I'm writing! It's so bad, I have to use Google Keep to write/save text (trustful app) and then copy-paste the entire thing into Notion.",1,2025-12-06 04:54:37,12,play_store,Notion,"Edit: issue still ongoing, I just lost several paragraphs due to the app not saving... It was my favourite app but I can't trust it anymore. // I'm so done with the saving/synchronization problems and losing entire paragraphs while I'm writing! It's so bad, I have to use Google Keep to write/save text (trustful app) and then copy-paste the entire thing into Notion."
"The ultimate all-in-one workspace! Notion has completely changed how I organize my life and work. I love that I can have my notes, databases, and project trackers all in one place. The customization is endless—you can make it as simple or as complex as you need. It’s the perfect tool for anyone who loves staying organized and aesthetic.",5,2026-01-14 17:53:58,2,play_store,Notion,"The ultimate all-in-one workspace! Notion has completely changed how I organize my life and work. I love that I can have my notes, databases, and project trackers all in one place. The customization is endless—you can make it as simple or as complex as you need. It’s the perfect tool for anyone who loves staying organized and aesthetic."
"I love this in using it free and so far so good, but I've not got any further than writing individual notes. idk what's going to happen when I string a few notes together and start a story, I'll review as and when I go on. 😉",5,2026-02-26 06:19:22,1,play_store,Notion,"I love this in using it free and so far so good, but I've not got any further than writing individual notes. idk what's going to happen when I string a few notes together and start a story, I'll review as and when I go on. 😉"
"I use notion for everything but the app leaves a lot to be desired . it's not the prettiest app, UI needs a LOT of work, but that's also just notion in general. It's also missing some features. I would only use this app to reference material you already have, inputting is an awful experience.",3,2026-02-10 00:19:27,4,play_store,Notion,"I use notion for everything but the app leaves a lot to be desired . it's not the prettiest app, UI needs a LOT of work, but that's also just notion in general. It's also missing some features. I would only use this app to reference material you already have, inputting is an awful experience."
I love it a lot helping me out with organization even though I don't remember organising half the time but still I enjoyed it a lot it's keeping all my notes of my fantasy world and some future notes for some ideas for novels,5,2026-01-23 21:58:14,0,play_store,Notion,I love it a lot helping me out with organization even though I don't remember organising half the time but still I enjoyed it a lot it's keeping all my notes of my fantasy world and some future notes for some ideas for novels
"Currently, this app has been testing my patience on a daily basis. A recent update has made my experience with kanban boards a living hell, every time I try to move a note to a different column it opens up the note's settings. Please for the love of god, find a different way to do this. I beg you.",3,2026-02-17 21:05:53,2,play_store,Notion,"Currently, this app has been testing my patience on a daily basis. A recent update has made my experience with kanban boards a living hell, every time I try to move a note to a different column it opens up the note's settings. Please for the love of god, find a different way to do this. I beg you."
"Significant problems. I'm always frustrated with Notion. Be it sharing in Android, load times, switching between accounts, copying data, auth, etc. Nothing really works well.",1,2026-02-23 21:37:24,1,play_store,Notion,"Significant problems. I'm always frustrated with Notion. Be it sharing in Android, load times, switching between accounts, copying data, auth, etc. Nothing really works well."
"This app has helped me stay organized, and it's easy to use. It's also a great app to write on, it doesn't get erased and stays as is unlike other apps. It also has a lot of functions whether you're an employee, a student, or just want to use it for personal use.",5,2026-02-15 09:00:17,2,play_store,Notion,"This app has helped me stay organized, and it's easy to use. It's also a great app to write on, it doesn't get erased and stays as is unlike other apps. It also has a lot of functions whether you're an employee, a student, or just want to use it for personal use."
"I love Notion, but in my samsung galaxy tab s10+ it doesnt work properly. I'm facing issues opening my pages as most times it opens a mobile layout that does nothing when clicking them. I can´t access them. I think it has to do with the DEX mode, that it's not working.",2,2026-03-02 01:22:48,3,play_store,Notion,"I love Notion, but in my samsung galaxy tab s10+ it doesnt work properly. I'm facing issues opening my pages as most times it opens a mobile layout that does nothing when clicking them. I can´t access them. I think it has to do with the DEX mode, that it's not working."
Notion has been my go-to as a freelance graphic designer. it's unfair to restrict my access after a failed subscription and still wants me to pay for the service I never used It's totally unfair,1,2026-02-04 14:17:03,2,play_store,Notion,Notion has been my go-to as a freelance graphic designer. it's unfair to restrict my access after a failed subscription and still wants me to pay for the service I never used It's totally unfair
"It's honestly a great app for taking daily notes, I regret having not found this earlier because it's way better than my OS-installed notes application. I use it both on my phone and computer, very great and super user-friendly, definitely recommending it to my friends!",5,2026-02-05 10:28:29,0,play_store,Notion,"It's honestly a great app for taking daily notes, I regret having not found this earlier because it's way better than my OS-installed notes application. I use it both on my phone and computer, very great and super user-friendly, definitely recommending it to my friends!"
"I LOVE the fact you are allowed to do so many things for free without a limited storage. This app is so organized, that's what I use for my OCs because my handwriting is bad, I don't want my hand to hurt, and I can do it anywhere I want!😼🤩",5,2026-02-21 01:37:47,0,play_store,Notion,"I LOVE the fact you are allowed to do so many things for free without a limited storage. This app is so organized, that's what I use for my OCs because my handwriting is bad, I don't want my hand to hurt, and I can do it anywhere I want!😼🤩"
"idk whats going on but won't let me use templates every time I click to use it it shows me the search page no matter what, this really bothered me because I love notion and wanted to use it to plan some big things in my life but I'll have to stick with my terrible phone note app for now until it's fixed.",1,2026-02-16 02:37:09,0,play_store,Notion,"idk whats going on but won't let me use templates every time I click to use it it shows me the search page no matter what, this really bothered me because I love notion and wanted to use it to plan some big things in my life but I'll have to stick with my terrible phone note app for now until it's fixed."
Notion app is extremely slow and lagging frequently. I am really annoyed by it.,1,2026-04-02 17:42:13,0,play_store,Notion,Notion app is extremely slow and lagging frequently. I am really annoyed by it.
"I love this app. This is perfect. I switched from Google docs, Google sheets, color notes app to this all in one platform.",5,2026-03-22 19:43:37,0,play_store,Notion,"I love this app. This is perfect. I switched from Google docs, Google sheets, color notes app to this all in one platform."
Simply Upset. Notion Freezes at Splash Screen and won't ever load. The app has been like this since two updates ago. Please Fix this Notion Team.,5,2026-03-18 22:57:15,7,play_store,Notion,Simply Upset. Notion Freezes at Splash Screen and won't ever load. The app has been like this since two updates ago. Please Fix this Notion Team.
"The app is bugged; it's not letting me edit the property number. When I click ""edit,"" nothing appears, but I can duplicate and delete that property! If you could fix it!",2,2026-02-21 18:43:13,1,play_store,Notion,"The app is bugged; it's not letting me edit the property number. When I click ""edit,"" nothing appears, but I can duplicate and delete that property! If you could fix it!"
"Just downloaded it and everytime I hit ""go"" the app crashes. All I see is a black screen. Killed the app like 5 times and reopened it to find that nothing is working.",1,2026-03-07 10:53:32,0,play_store,Notion,"Just downloaded it and everytime I hit ""go"" the app crashes. All I see is a black screen. Killed the app like 5 times and reopened it to find that nothing is working."
"this app is really useful, loads fast, easy to understand+ the ai inside is very fast at finding folders for you with just key words, especially when you forget/disorganised things alot. highly recommend",5,2026-03-16 22:45:30,1,play_store,Notion,"this app is really useful, loads fast, easy to understand+ the ai inside is very fast at finding folders for you with just key words, especially when you forget/disorganised things alot. highly recommend"
"It's a little hard to get around and figure it out at first. Though I soon got it and I love it. This app is very helpful for people who struggle to study or get things done. I used to procrastinate a lot until I got this app. Thank you, Notion!!!",4,2026-01-28 20:50:09,3,play_store,Notion,"It's a little hard to get around and figure it out at first. Though I soon got it and I love it. This app is very helpful for people who struggle to study or get things done. I used to procrastinate a lot until I got this app. Thank you, Notion!!!"
"Notion widgets are very inefficient, slow , not easy to add to the home screen. Desktop works fine .",3,2026-03-15 02:07:55,5,play_store,Notion,"Notion widgets are very inefficient, slow , not easy to add to the home screen. Desktop works fine ."
"Really dislike the recent update / changes to the Ai tool. The Ai tool is very useful for me, many of the core features were ""improve writing"" and the interaction button with the Ai itself doesn't work anymore.",1,2026-03-11 04:58:24,3,play_store,Notion,"Really dislike the recent update / changes to the Ai tool. The Ai tool is very useful for me, many of the core features were ""improve writing"" and the interaction button with the Ai itself doesn't work anymore."
this is the best app I have ever seen because it helps me to not do everything which I want through anytime anywhere anything I don't want to sugar coat but it is most good for notes not every time but it also lag or disconnect to the network,5,2026-03-11 14:23:59,2,play_store,Notion,this is the best app I have ever seen because it helps me to not do everything which I want through anytime anywhere anything I don't want to sugar coat but it is most good for notes not every time but it also lag or disconnect to the network
"It is better than Trello and easier to work with than Obsidian. Biggest pro is cross-platform sync and ease of use. If you ever share a workspace with sb, there's an annoying paywall. Easy fix - Settings - People - Remove the other member.",4,2026-01-21 18:01:03,4,play_store,Notion,"It is better than Trello and easier to work with than Obsidian. Biggest pro is cross-platform sync and ease of use. If you ever share a workspace with sb, there's an annoying paywall. Easy fix - Settings - People - Remove the other member."
Notion is amazingly flexible and I was able to build a template that really works for the way my brain functions!,5,2026-03-21 18:26:19,2,play_store,Notion,Notion is amazingly flexible and I was able to build a template that really works for the way my brain functions!
