content,score,at,thumbsUpCount,source,app_name,text,clean_text,sentiment_compound,sentiment_positive,sentiment_negative,sentiment_label,cluster_id,topic_category
An excellent database with a user friendly GUI. Wish one GUI could handle multiple databases..,4,2026-02-14 21:49:28,0,play_store,Notion,An excellent database with a user friendly GUI. Wish one GUI could handle multiple databases..,an excellent database with a user friendly gui wish one gui could handle multiple databases,0.8625,0.444,0.0,positive,3,Bugs & crashes
great app for productivity - both personal and professional. really a game changer for organising the data and planning things .,5,2026-01-25 10:12:06,0,play_store,Notion,great app for productivity - both personal and professional. really a game changer for organising the data and planning things .,great app for productivity - both personal and professional really a game changer for organising the data and planning things,0.6249,0.177,0.0,positive,1,Features
love but wish i could take a pic on my android phone directly into a note rather than have to attach it or them from my gallery.,4,2026-01-17 00:29:26,0,play_store,Notion,love but wish i could take a pic on my android phone directly into a note rather than have to attach it or them from my gallery.,love but wish i could take a pic on my android phone directly into a note rather than have to attach it or them from my gallery,0.7311,0.197,0.0,positive,4,Other
"There is one bug I will ask you to fix, it doesnt remember the last opened window every time I reenter the app, and I have to find and open the window again",5,2026-01-25 21:09:49,1,play_store,Notion,"There is one bug I will ask you to fix, it doesnt remember the last opened window every time I reenter the app, and I have to find and open the window again",there is one bug i will ask you to fix it doesnt remember the last opened window every time i reenter the app and i have to find and open the window again,0.0,0.0,0.0,neutral,3,Bugs & crashes
"there is too much lag and glitch while typing in journal section, specially on smart phone while it well in pc kindly correct it",3,2026-03-06 19:21:05,1,play_store,Notion,"there is too much lag and glitch while typing in journal section, specially on smart phone while it well in pc kindly correct it",there is too much lag and glitch while typing in journal section specially on smart phone while it well in pc kindly correct it,0.6808,0.263,0.079,positive,2,UX & design
"I love it! I use it for projects, writing small novels and personal organisation.",5,2026-01-24 22:13:25,0,play_store,Notion,"I love it! I use it for projects, writing small novels and personal organisation.",i love it i use it for projects writing small novels and personal organisation,0.6369,0.244,0.0,positive,1,Features
One of the best platform I ever used. Very useful aerospace and easy and fast,5,2026-01-19 05:29:56,0,play_store,Notion,One of the best platform I ever used. Very useful aerospace and easy and fast,one of the best platform i ever used very useful aerospace and easy and fast,0.8832,0.462,0.0,positive,2,UX & design
I use this for for my general living lifestyle to do dashboard. I find it really effective at updating. I really love notion.,5,2026-02-19 05:57:20,0,play_store,Notion,I use this for for my general living lifestyle to do dashboard. I find it really effective at updating. I really love notion.,i use this for for my general living lifestyle to do dashboard i find it really effective at updating i really love notion,0.8354,0.273,0.0,positive,1,Features
"best app for documentation, I love the subpages concept, eliminates what google docs or word does and having so many documents that aren't linked together",5,2026-03-07 11:35:03,0,play_store,Notion,"best app for documentation, I love the subpages concept, eliminates what google docs or word does and having so many documents that aren't linked together",best app for documentation i love the subpages concept eliminates what google docs or word does and having so many documents that aren't linked together,0.8555,0.268,0.0,positive,0,Other
"Absolutely the best app ever! its like my hub for my life!!! brilliantly designed as if you read my mind in what I wanted in an app, thank you!",5,2026-02-22 22:15:48,0,play_store,Notion,"Absolutely the best app ever! its like my hub for my life!!! brilliantly designed as if you read my mind in what I wanted in an app, thank you!",absolutely the best app ever its like my hub for my life brilliantly designed as if you read my mind in what i wanted in an app thank you,0.9257,0.35,0.0,positive,0,Other
"Put the old format back, there is no need to do all this stupid changes it's getting annoying ESPECIALLY with the AI",1,2026-02-26 00:31:52,3,play_store,Notion,"Put the old format back, there is no need to do all this stupid changes it's getting annoying ESPECIALLY with the AI",put the old format back there is no need to do all this stupid changes it's getting annoying especially with the ai,-0.836,0.0,0.319,negative,5,Features
"it's overwhelmingly complicated at first, and you only use like 20% of what it can do. but for storing information everywhere then being able to manipulate that information and share it everywhere",5,2026-01-25 14:59:25,1,play_store,Notion,"it's overwhelmingly complicated at first, and you only use like 20% of what it can do. but for storing information everywhere then being able to manipulate that information and share it everywhere",it's overwhelmingly complicated at first and you only use like 20 of what it can do but for storing information everywhere then being able to manipulate that information and share it everywhere,0.5106,0.131,0.036,positive,2,UX & design
"I would like to express my heartfelt gratitude for the exceptional entertainment service that has truly enhanced my experience with productivity and organization. The platform, Notion, stands out for its remarkable ability to seamlessly integrate various functionalities, making it an indispensable tool for managing notes and tasks alike. Its intuitive interface allows for effortless navigation, enabling users to create and organize their thoughts and responsibilities in a visually appealing mann",5,2026-03-06 22:31:41,1,play_store,Notion,"I would like to express my heartfelt gratitude for the exceptional entertainment service that has truly enhanced my experience with productivity and organization. The platform, Notion, stands out for its remarkable ability to seamlessly integrate various functionalities, making it an indispensable tool for managing notes and tasks alike. Its intuitive interface allows for effortless navigation, enabling users to create and organize their thoughts and responsibilities in a visually appealing mann",i would like to express my heartfelt gratitude for the exceptional entertainment service that has truly enhanced my experience with productivity and organization the platform notion stands out for its remarkable ability to seamlessly integrate various functionalities making it an indispensable tool for managing notes and tasks alike its intuitive interface allows for effortless navigation enabling users to create and organize their thoughts and responsibilities in a visually appealing mann,0.9694,0.273,0.0,positive,2,UX & design
"The app is really good. It keeps pushing AI ""solutions"" which is really annoying",4,2026-02-22 17:53:39,0,play_store,Notion,"The app is really good. It keeps pushing AI ""solutions"" which is really annoying",the app is really good it keeps pushing ai solutions which is really annoying,0.2263,0.259,0.158,positive,5,Features
"It baffles and enrages me at the same time how bad this app is. It's extremely slow and what's worse, it has a bug where a no matter which page you click on, it always opens your most common page. Most of my data is now inaccessible",1,2025-12-26 15:10:24,3,play_store,Notion,"It baffles and enrages me at the same time how bad this app is. It's extremely slow and what's worse, it has a bug where a no matter which page you click on, it always opens your most common page. Most of my data is now inaccessible",it baffles and enrages me at the same time how bad this app is it's extremely slow and what's worse it has a bug where a no matter which page you click on it always opens your most common page most of my data is now inaccessible,-0.8582,0.0,0.196,negative,3,Bugs & crashes
I regret using this for my portfolio They keep making stupid updates all images I uploaded on my portfolio is gone all because they want to put images in some sort of way,1,2026-03-20 01:24:22,0,play_store,Notion,I regret using this for my portfolio They keep making stupid updates all images I uploaded on my portfolio is gone all because they want to put images in some sort of way,i regret using this for my portfolio they keep making stupid updates all images i uploaded on my portfolio is gone all because they want to put images in some sort of way,-0.7096,0.035,0.165,negative,4,Other
"App version needs to be more user friendly, simple and creative",4,2026-03-07 20:47:31,0,play_store,Notion,"App version needs to be more user friendly, simple and creative",app version needs to be more user friendly simple and creative,0.749,0.415,0.0,positive,1,Features
"Excellent All-in-one app. Syncs seamlessly across devices. Requires a bit of learning to use it to its full potential. invest your time in learning the app, reap the rewards of freeing up your time for better use.",5,2025-11-20 09:50:41,4,play_store,Notion,"Excellent All-in-one app. Syncs seamlessly across devices. Requires a bit of learning to use it to its full potential. invest your time in learning the app, reap the rewards of freeing up your time for better use.",excellent all-in-one app syncs seamlessly across devices requires a bit of learning to use it to its full potential invest your time in learning the app reap the rewards of freeing up your time for better use,0.9153,0.279,0.0,positive,2,UX & design
"I like it because it makes things easier, can you add, like word search, because it takes a lot of time, when there are too many notes, when there is some kind of word search maybe it can make things a lot easier, hopefully there will be an update for word search",5,2025-11-21 14:40:58,1,play_store,Notion,"I like it because it makes things easier, can you add, like word search, because it takes a lot of time, when there are too many notes, when there is some kind of word search maybe it can make things a lot easier, hopefully there will be an update for word search",i like it because it makes things easier can you add like word search because it takes a lot of time when there are too many notes when there is some kind of word search maybe it can make things a lot easier hopefully there will be an update for word search,0.9062,0.221,0.0,positive,2,UX & design
"There is no ""Favorite"" section in Home part in Android app after last update and I hope it's bug cause if this is ""feature"" it's worse idea ever and it will force me to stop using Notion after 3 years of actively using it.",1,2026-02-25 14:26:20,1,play_store,Notion,"There is no ""Favorite"" section in Home part in Android app after last update and I hope it's bug cause if this is ""feature"" it's worse idea ever and it will force me to stop using Notion after 3 years of actively using it.",there is no favorite section in home part in android app after last update and i hope it's bug cause if this is feature it's worse idea ever and it will force me to stop using notion after 3 years of actively using it,-0.3777,0.1,0.15,negative,0,Other
"incredibly laggy, keeps crashing nonstop. crashes on an ipad aswell. ive been on different wifi networks, ive used it in the browser. ive just tried the desktop version, same issue. practically unusable. crashes nonstop regardless.",1,2025-12-06 18:29:15,2,play_store,Notion,"incredibly laggy, keeps crashing nonstop. crashes on an ipad aswell. ive been on different wifi networks, ive used it in the browser. ive just tried the desktop version, same issue. practically unusable. crashes nonstop regardless.",incredibly laggy keeps crashing nonstop crashes on an ipad aswell ive been on different wifi networks ive used it in the browser ive just tried the desktop version same issue practically unusable crashes nonstop regardless,0.0,0.0,0.0,neutral,3,Bugs & crashes
"The mobile version is terrible. Pages are loading slow, the feedback when you try to do anything is super bad and slow. Nobody would be using the app, if not the great web version. Unimaginable how such app can be produced by the same team.",1,2025-11-21 03:37:14,5,play_store,Notion,"The mobile version is terrible. Pages are loading slow, the feedback when you try to do anything is super bad and slow. Nobody would be using the app, if not the great web version. Unimaginable how such app can be produced by the same team.",the mobile version is terrible pages are loading slow the feedback when you try to do anything is super bad and slow nobody would be using the app if not the great web version unimaginable how such app can be produced by the same team,-0.7179,0.071,0.181,negative,1,Features
"Notion is an excellent all-in-one app for notes, tasks, planning, and productivity. I use it daily to organize my studies, goals, and routines in one place. The flexibility, clean interface, and powerful features make planning simple and effective. It feels like a second brain. Highly recommended for students and professionals.",5,2025-12-20 18:05:44,8,play_store,Notion,"Notion is an excellent all-in-one app for notes, tasks, planning, and productivity. I use it daily to organize my studies, goals, and routines in one place. The flexibility, clean interface, and powerful features make planning simple and effective. It feels like a second brain. Highly recommended for students and professionals.",notion is an excellent all-in-one app for notes tasks planning and productivity i use it daily to organize my studies goals and routines in one place the flexibility clean interface and powerful features make planning simple and effective it feels like a second brain highly recommended for students and professionals,0.9538,0.31,0.0,positive,4,Other
"Notion on tablet/desktop is better. On mobile, you can't do or see columns even on landscape mode. Slash command is gone, you can't type :emoji: to add an emoji, and the ""find"" fails to actually locate where the word you're searching for is and instead just redirect you to the page the word is found in. Other than that, there's no issue for me. App's great, but the mobile version can do better than this imo.",4,2025-12-03 07:51:27,3,play_store,Notion,"Notion on tablet/desktop is better. On mobile, you can't do or see columns even on landscape mode. Slash command is gone, you can't type :emoji: to add an emoji, and the ""find"" fails to actually locate where the word you're searching for is and instead just redirect you to the page the word is found in. Other than that, there's no issue for me. App's great, but the mobile version can do better than this imo.",notion on tablet desktop is better on mobile you can't do or see columns even on landscape mode slash command is gone you can't type emoji to add an emoji and the find fails to actually locate where the word you're searching for is and instead just redirect you to the page the word is found in other than that there's no issue for me app's great but the mobile version can do better than this imo,0.6486,0.099,0.06,positive,1,Features
"Do not sign up for annual billing, unless you happen to be an expert on their billing process! while just getting started with the app, I added a friend to collaborate on a project. Surprise! My annual bill was doubled!",1,2025-12-18 04:53:30,2,play_store,Notion,"Do not sign up for annual billing, unless you happen to be an expert on their billing process! while just getting started with the app, I added a friend to collaborate on a project. Surprise! My annual bill was doubled!",do not sign up for annual billing unless you happen to be an expert on their billing process while just getting started with the app i added a friend to collaborate on a project surprise my annual bill was doubled,0.6486,0.122,0.0,positive,0,Other
First it was good but after the update I am unable to load or open my uploaded photos ...please fix this issue,1,2026-02-27 06:45:39,2,play_store,Notion,First it was good but after the update I am unable to load or open my uploaded photos ...please fix this issue,first it was good but after the update i am unable to load or open my uploaded photos please fix this issue,0.5994,0.197,0.0,positive,3,Bugs & crashes
Connection is a lot better. Doesn't lag as much. Very intuitive. A bit annoying when you type '@' then it slides your screen all the way down. But it's cross platform so super convenient and the templates are amazing.,5,2025-10-19 04:35:55,2,play_store,Notion,Connection is a lot better. Doesn't lag as much. Very intuitive. A bit annoying when you type '@' then it slides your screen all the way down. But it's cross platform so super convenient and the templates are amazing.,connection is a lot better doesn't lag as much very intuitive a bit annoying when you type ' ' then it slides your screen all the way down but it's cross platform so super convenient and the templates are amazing,0.9414,0.298,0.035,positive,2,UX & design
"Edit: recently pressing the back button on my devices not only hides the on screen keyboard but also takes me back to a previous page that I accessed before the current page. This is kind of annoying, I just want to hide the keyboard so I can see the whole page easily. Please fix this. thank you.",3,2025-12-13 08:08:57,27,play_store,Notion,"Edit: recently pressing the back button on my devices not only hides the on screen keyboard but also takes me back to a previous page that I accessed before the current page. This is kind of annoying, I just want to hide the keyboard so I can see the whole page easily. Please fix this. thank you.",edit recently pressing the back button on my devices not only hides the on screen keyboard but also takes me back to a previous page that i accessed before the current page this is kind of annoying i just want to hide the keyboard so i can see the whole page easily please fix this thank you,0.6085,0.176,0.089,positive,0,Other
"I have multiple notes in my notebook. But no matter what note I open. It only opens one especific note, very strange . Works fine in browser though. Have tried clearing cache and all data, which temporarily solved the issue but it reappeared again now. Will give full star if the problem gets solved in next update.",3,2025-10-24 07:35:00,0,play_store,Notion,"I have multiple notes in my notebook. But no matter what note I open. It only opens one especific note, very strange . Works fine in browser though. Have tried clearing cache and all data, which temporarily solved the issue but it reappeared again now. Will give full star if the problem gets solved in next update.",i have multiple notes in my notebook but no matter what note i open it only opens one especific note very strange works fine in browser though have tried clearing cache and all data which temporarily solved the issue but it reappeared again now will give full star if the problem gets solved in next update,0.1519,0.121,0.112,positive,3,Bugs & crashes
"amazing Manager, a little confusing but once you learn it's amazing.",5,2026-03-22 22:17:56,0,play_store,Notion,"amazing Manager, a little confusing but once you learn it's amazing.",amazing manager a little confusing but once you learn it's amazing,0.8072,0.45,0.077,positive,2,UX & design
"$10B Valuation Not Because of the App. Great product, awesome on desktop, fantastic features. The app is buggy clunky app makes for an unpleasant UX",3,2026-03-23 10:55:02,0,play_store,Notion,"$10B Valuation Not Because of the App. Great product, awesome on desktop, fantastic features. The app is buggy clunky app makes for an unpleasant UX",10b valuation not because of the app great product awesome on desktop fantastic features the app is buggy clunky app makes for an unpleasant ux,0.8658,0.329,0.086,positive,1,Features
"The new update made it so no images work, and no images can be uploaded either",1,2026-03-18 07:04:06,2,play_store,Notion,"The new update made it so no images work, and no images can be uploaded either",the new update made it so no images work and no images can be uploaded either,-0.6207,0.0,0.266,negative,3,Bugs & crashes
everyday driver. ai and notes. also excellent transcription voice recognition,5,2026-03-29 19:04:29,0,play_store,Notion,everyday driver. ai and notes. also excellent transcription voice recognition,everyday driver ai and notes also excellent transcription voice recognition,0.5719,0.291,0.0,positive,5,Features
This is very good - it provides everything i need in a note taking app.,5,2026-03-20 07:17:34,0,play_store,Notion,This is very good - it provides everything i need in a note taking app.,this is very good - it provides everything i need in a note taking app,0.4927,0.186,0.0,positive,4,Other
terrible update. i cant insert an image. only asking ai is available. why do i need to talk to ai. please stop pushing this AI slop,1,2026-03-14 11:08:43,1,play_store,Notion,terrible update. i cant insert an image. only asking ai is available. why do i need to talk to ai. please stop pushing this AI slop,terrible update i cant insert an image only asking ai is available why do i need to talk to ai please stop pushing this ai slop,-0.4588,0.075,0.173,negative,5,Features
The Pc Version is great but the Mobile version is just useless.,2,2026-03-23 13:02:32,0,play_store,Notion,The Pc Version is great but the Mobile version is just useless.,the pc version is great but the mobile version is just useless,-0.2846,0.157,0.228,negative,1,Features
"This system offers a wide range of use cases, with significant adaptability and capabilities. Ongoing improvements are continuously enhancing the application and user experience! Great work from the Notion Team😎",5,2026-03-16 22:17:59,0,play_store,Notion,"This system offers a wide range of use cases, with significant adaptability and capabilities. Ongoing improvements are continuously enhancing the application and user experience! Great work from the Notion Team😎",this system offers a wide range of use cases with significant adaptability and capabilities ongoing improvements are continuously enhancing the application and user experience great work from the notion team,0.802,0.233,0.0,positive,0,Other
I think the app is good and useful but seems this is too complicated for simple tasks.,5,2026-03-31 18:03:24,0,play_store,Notion,I think the app is good and useful but seems this is too complicated for simple tasks.,i think the app is good and useful but seems this is too complicated for simple tasks,0.4404,0.206,0.0,positive,4,Other
Mobile Notion needs an optimization but notion insteads focus on implementing AI features that you need to pay.,1,2026-04-03 00:39:21,1,play_store,Notion,Mobile Notion needs an optimization but notion insteads focus on implementing AI features that you need to pay.,mobile notion needs an optimization but notion insteads focus on implementing ai features that you need to pay,0.0516,0.093,0.082,positive,5,Features
Very bad interface and slow to use on android,1,2026-03-19 20:12:01,0,play_store,Notion,Very bad interface and slow to use on android,very bad interface and slow to use on android,-0.5849,0.0,0.322,negative,1,Features
"Issues: - Text box triggers Google Password panel, which is annoying. - Ai Chat Session is only one way sync from Web / macOS dmg to mobile phone. A refresh button might needed. Device: Google Pixel 8 Pro Android version: 16 Android security update: March 5, 2026 Notion Version: Latest on March 16, 2026",4,2026-03-25 13:04:53,1,play_store,Notion,"Issues: - Text box triggers Google Password panel, which is annoying. - Ai Chat Session is only one way sync from Web / macOS dmg to mobile phone. A refresh button might needed. Device: Google Pixel 8 Pro Android version: 16 Android security update: March 5, 2026 Notion Version: Latest on March 16, 2026",issues - text box triggers google password panel which is annoying - ai chat session is only one way sync from web macos dmg to mobile phone a refresh button might needed device google pixel 8 pro android version 16 android security update march 5 2026 notion version latest on march 16 2026,-0.0772,0.043,0.048,negative,1,Features
New update causes app to crash when opening.,1,2026-03-19 02:46:07,0,play_store,Notion,New update causes app to crash when opening.,new update causes app to crash when opening,-0.4019,0.0,0.278,negative,3,Bugs & crashes
Very useful and easy when you understood,5,2026-03-15 07:12:02,0,play_store,Notion,Very useful and easy when you understood,very useful and easy when you understood,0.7474,0.56,0.0,positive,2,UX & design
